StationID,RzSocial,Endereco,Bairro,Bandeira,PcVenda,PcCompra,ModCompra,Fornecedor,DtColeta,Cidade,Produto,UnidMedida,DtInicial,DtFinal,Estado,CodIBGE,Place,Lon,Lat,DistMean,DistDev,DistMin,DistMax,RefinMean,RefinDev,RefinMin,RefinMax
584,PLANALTO PETROLEO PARQUE PIAUI LTDA,"AVENIDA PREFEITO WALL FERRAZ, S/N PISTA MARGINAL",Parque Piaui,IPIRANGA,3.831,NA,"NA","NA",2020-04-30,TERESINA,Gasolina,R$/l,2020-04-26,2020-05-02,PIAUI,2211001,"AVENIDA PREFEITO WALL FERRAZ, S/N PISTA MARGINAL, Parque Piaui, TERESINA, PIAUI, BRAZIL",-42.7822154,-5.1416705,499383.9382385079,195707.21275084242,5570.948570906184,757090.4380058933,1758404.123483943,733546.6692507075,503684.7544027315,3132438.6662364556
585,POSTO CRISTO REI LTDA,"AVENIDA BARAO DE CASTELO BRANCO, 2041",Cristo Rei,BRANCA,3.84,NA,"NA","NA",2020-04-30,TERESINA,Gasolina,R$/l,2020-04-26,2020-05-02,PIAUI,2211001,"AVENIDA BARAO DE CASTELO BRANCO, 2041, Cristo Rei, TERESINA, PIAUI, BRAZIL",-42.7894267,-5.096883399999999,497932.0490119122,196112.57557259072,3001.598088298881,753739.5597323861,1762030.130190719,734492.2228778431,502938.26662272366,3136945.095866835
586,",POSTO TOTA LTDA.","AVENIDA PREFEITOWALL FERRAZ, 8370 SUL",Lourival Parente,RAIZEN,3.84,NA,"NA","NA",2020-04-30,TERESINA,Gasolina,R$/l,2020-04-26,2020-05-02,PIAUI,2211001,"AVENIDA PREFEITOWALL FERRAZ, 8370 SUL, Lourival Parente, TERESINA, PIAUI, BRAZIL",-42.7905181,-5.1344331,499110.31536163605,195679.63393062292,5326.8072764708095,755882.8812294584,1759044.6046525268,733358.5172274774,504313.84991757735,3132936.679454227
587,SÃO DOMINGOS COMÉRCIO DE PETRÓLEO E LUBRIFICANTES LTDA.,"AVENIDA BARAODEGURGUEIA, 4045 SUL",Vermelha,SABBÁ,3.84,NA,"NA","NA",2020-04-30,TERESINA,Gasolina,R$/l,2020-04-26,2020-05-02,PIAUI,2211001,"AVENIDA BARAODEGURGUEIA, 4045 SUL, Vermelha, TERESINA, PIAUI, BRAZIL",-42.7995041,-5.1242984,498761.30965345056,195632.10647738547,5211.161225747436,754437.935861863,1759921.8219503995,733221.3502554182,504919.58893884567,3133719.629511986
588,R B COELHO E CIA LTDA,"AVENIDA BARAO DE CASTELO BRANCO, 53",Tres Andares,IPIRANGA,3.84,NA,"NA","NA",2020-04-29,TERESINA,Gasolina,R$/l,2020-04-26,2020-05-02,PIAUI,2211001,"AVENIDA BARAO DE CASTELO BRANCO, 53, Tres Andares, TERESINA, PIAUI, BRAZIL",-42.7931739,-5.1138957,498435.8707972231,195899.74055806198,3979.7603535001617,754405.1303188651,1760701.980207906,733823.6445301769,503901.41793411755,3135024.2366860737
589,T. M. VALENÇA LTDA.,"AVENIDA TANCREDO NEVES, 8575 SUL",Lourival Parente,BRANCA,3.84,NA,"NA","NA",2020-04-30,TERESINA,Gasolina,R$/l,2020-04-26,2020-05-02,PIAUI,2211001,"AVENIDA TANCREDO NEVES, 8575 SUL, Lourival Parente, TERESINA, PIAUI, BRAZIL",-42.7962222,-5.12351,498739.1940816,195716.22519340334,4872.803420687211,754696.4636719595,1759959.1575791384,733400.921278517,504546.4364864828,3133908.7219123095
590,CREMILDA GOMES ALVES & CIA. LTDA. - ME,"AVENIDA MIGUEL ROSA, 6741",Taboleta,IPIRANGA,3.84,NA,"NA","NA",2020-04-29,TERESINA,Gasolina,R$/l,2020-04-26,2020-05-02,PIAUI,2211001,"AVENIDA MIGUEL ROSA, 6741, Taboleta, TERESINA, PIAUI, BRAZIL",-42.7988009,-5.115961299999999,498497.8031334378,195742.42062916447,4633.968866057185,754003.989752064,1760580.9473829227,733495.2664456087,504565.21559652645,3134624.502365452
591,POSTO HIDROLANDIA LTDA,"AVENIDA MIGUEL ROSA, 5635",Macauba,IPIRANGA,3.84,NA,"NA","NA",2020-04-29,TERESINA,Gasolina,R$/l,2020-04-26,2020-05-02,PIAUI,2211001,"AVENIDA MIGUEL ROSA, 5635, Macauba, TERESINA, PIAUI, BRAZIL",-42.805029,-5.1084594,498270.1333088468,195649.88255776494,4943.385344095059,752974.346315646,1761227.7066651876,733413.8389044289,504972.9521457509,3135218.0218713256
592,M.E.ARAGAO,"AVENIDA BARAO DE GURGUEIA, 3719 0",Tabuleta,IPIRANGA,3.84,NA,"NA","NA",2020-04-30,TERESINA,Gasolina,R$/l,2020-04-26,2020-05-02,PIAUI,2211001,"AVENIDA BARAO DE GURGUEIA, 3719 0, Tabuleta, TERESINA, PIAUI, BRAZIL",-42.8013171,-5.122093899999999,498689.44078889827,195616.42644048805,5229.810223164534,754136.8531570947,1760111.6351704174,733198.2836809723,505036.8854949762,3133894.5555359665
593,J A SILVA MERCADINHO,"RUA MINISTRO PEDRO BORGES, 1560",Taboleta,BRANCA,3.849,NA,"NA","NA",2020-04-29,TERESINA,Gasolina,R$/l,2020-04-26,2020-05-02,PIAUI,2211001,"RUA MINISTRO PEDRO BORGES, 1560, Taboleta, TERESINA, PIAUI, BRAZIL",-42.7974239,-5.119007,498594.1067529914,195742.67036084607,4680.931646170662,754314.7094346508,1760327.4260809722,733473.2965521165,504521.8974744288,3134346.5297945826
594,TERESINA GAS LTDA,"AVENIDA BARAO DE GURGUEIA, 1852",Vermelha,RAIZEN,3.849,NA,"NA","NA",2020-04-30,TERESINA,Gasolina,R$/l,2020-04-26,2020-05-02,PIAUI,2211001,"AVENIDA BARAO DE GURGUEIA, 1852, Vermelha, TERESINA, PIAUI, BRAZIL",-42.8085545,-5.1076896,498248.6524717337,195564.85861536278,5295.892981851617,752599.5372815009,1761316.6459332008,733267.6338146335,505320.1264045821,3135186.1341321697
595,POSTO SANTA MARIA LTDA,"AVENIDA PREFEITO WALL FERRAZ, 9365",Lourival Parente,BRANCA,3.849,NA,"NA","NA",2020-04-29,TERESINA,Gasolina,R$/l,2020-04-26,2020-05-02,PIAUI,2211001,"AVENIDA PREFEITO WALL FERRAZ, 9365, Lourival Parente, TERESINA, PIAUI, BRAZIL",-42.7824287,-5.1405998,499346.12875159166,195722.38043297868,5471.90271002717,757006.3085047473,1758491.0267586373,733567.3752449605,503670.65159947803,3132545.0632857573
596,TRANSSERVICE PETROLEO LTDA,"AVENIDA BARAO DE GURGUEIA, 2300",Sao Pedro,BRANCA,3.85,NA,"NA","NA",2020-04-30,TERESINA,Gasolina,R$/l,2020-04-26,2020-05-02,PIAUI,2211001,"AVENIDA BARAO DE GURGUEIA, 2300, Sao Pedro, TERESINA, PIAUI, BRAZIL",-42.806712,-5.111646899999999,498365.5109491575,195584.71575989726,5232.602413110985,753008.1843841157,1760986.6254568275,733241.6450352028,505257.1145288825,3134826.5663562124
597,POSTO DE COMBUSTIVEIS SETE LTDA,"AVENIDA PEDRO FREITAS, 1765",Vermelha,TDC DISTRIBUIDORA,3.851,NA,"NA","NA",2020-04-29,TERESINA,Gasolina,R$/l,2020-04-26,2020-05-02,PIAUI,2211001,"AVENIDA PEDRO FREITAS, 1765, Vermelha, TERESINA, PIAUI, BRAZIL",-42.8117776,-5.1080421,498260.29921830184,195480.64458387397,5651.541730537652,752320.1305176282,1761313.755395869,733103.5675799112,505672.6895880444,3135045.2284080987
598,PLANALTO PETROLEO CENTRO LTDA,"RUA RUI BARBOSA (ZONA SUL), 923",Centro,SABBÁ,3.851,NA,"NA","NA",2020-04-29,TERESINA,Gasolina,R$/l,2020-04-26,2020-05-02,PIAUI,2211001,"RUA RUI BARBOSA (ZONA SUL), 923, Centro, TERESINA, PIAUI, BRAZIL",-42.8124609,-5.0989277,498000.3448036626,195502.51386172947,5564.920153583727,751711.2017180048,1762046.2683566227,733333.3535730416,505442.94428510894,3135987.9215436084
599,CLEONICE FERREIRA SILVA,"AVENIDA BARAO DE GURGUEIA, 2635",Vermelha,BRANCA,3.851,NA,"NA","NA",2020-04-30,TERESINA,Gasolina,R$/l,2020-04-26,2020-05-02,PIAUI,2211001,"AVENIDA BARAO DE GURGUEIA, 2635, Vermelha, TERESINA, PIAUI, BRAZIL",-42.8052577,-5.114048899999999,498437.95437372,195601.76528596575,5181.48181754069,753287.5800683919,1760783.7258583487,733241.9054586209,505183.5823730865,3134619.135234334
600,CACIQUE PETROLEO LTDA,"AVENIDA MIGUEL ROSA, 6185 0",Tabuleta,PETROBRAS DISTRIBUIDORA S.A.,3.873,NA,"NA","NA",2020-04-29,TERESINA,Gasolina,R$/l,2020-04-26,2020-05-02,PIAUI,2211001,"AVENIDA MIGUEL ROSA, 6185 0, Tabuleta, TERESINA, PIAUI, BRAZIL",-42.8020879,-5.112130100000001,498379.5840737508,195696.76949059503,4774.885423063181,753468.223454774,1760912.023417755,733448.6028774007,504784.43549024145,3134924.162105106
601,CACIQUE PETROLEO LTDA,"AVENIDA MIGUEL ROSA, 5178 SUL",Vermelha,PETROBRAS DISTRIBUIDORA S.A.,3.873,NA,"NA","NA",2020-04-29,TERESINA,Gasolina,R$/l,2020-04-26,2020-05-02,PIAUI,2211001,"AVENIDA MIGUEL ROSA, 5178 SUL, Vermelha, TERESINA, PIAUI, BRAZIL",-42.80591219999999,-5.1044244,498152.55268411123,195650.74057869287,4927.539686314423,752650.6712488664,1761556.4708028936,733487.8354222997,504932.18775301863,3135616.6488015344
602,P. O. CORTEZ LIMA E CIA LTDA,"AVENIDA JOSE DOS SANTOS E SILVA, 4453",Nossa Senhora das Gracas,ALESAT,3.879,NA,"NA","NA",2020-04-30,TERESINA,Gasolina,R$/l,2020-04-26,2020-05-02,PIAUI,2211001,"AVENIDA JOSE DOS SANTOS E SILVA, 4453, Nossa Senhora das Gracas, TERESINA, PIAUI, BRAZIL",-42.8000361,-5.097728,497960.18542749726,195829.49861928605,4181.455030780831,752799.1129297514,1762044.993836658,733961.1534961528,504088.61889755813,3136514.296741138
603,R & J COMBUSTIVEIS LTDA,"AVENIDA ODILON ARAUJO, 1387",Cristo Rei,BRANCA,3.949,NA,"NA","NA",2020-04-30,TERESINA,Gasolina,R$/l,2020-04-26,2020-05-02,PIAUI,2211001,"AVENIDA ODILON ARAUJO, 1387, Cristo Rei, TERESINA, PIAUI, BRAZIL",-42.7920272,-5.1023811,498088.5271684189,196022.48807068632,3375.3805634120295,753824.4329765864,1761611.5435149556,734209.8764539004,503395.85819188086,3136279.610750745
604,PLANALTO PETROLEO KM 7 LTDA,"AVENIDA PREFEITO WALL FERRAZ, 11133",Santo Antonio,PETROBRAS DISTRIBUIDORA S.A.,3.971,NA,"NA","NA",2020-04-29,TERESINA,Gasolina,R$/l,2020-04-26,2020-05-02,PIAUI,2211001,"AVENIDA PREFEITO WALL FERRAZ, 11133, Santo Antonio, TERESINA, PIAUI, BRAZIL",-42.7736689,-5.147541599999999,499627.7563445343,195727.37250670366,5902.367473644824,758238.690520801,1757871.0673783973,733786.0221593478,502985.16371424263,3132093.410608039
605,L DE OLIVEIRA SARAIVA EIRELI - EPP,"AVENIDA PREFEITO WALL FERRAZ, 11269",Santo Antonio,SABBÁ,3.979,NA,"NA","NA",2020-04-29,TERESINA,Gasolina,R$/l,2020-04-26,2020-05-02,PIAUI,2211001,"AVENIDA PREFEITO WALL FERRAZ, 11269, Santo Antonio, TERESINA, PIAUI, BRAZIL",-42.7728189,-5.1512616,499762.8799825345,195670.10118121188,6287.011287790288,758541.2097879234,1757568.4542767121,733719.2570911909,503023.66843708156,3131727.334703574
606,PIPEL-PICOS PETROLEO LTDA,"AVENIDA PREF. WALL FERRAZ, 7420",Triunfo,BRANCA,3.979,NA,"NA","NA",2020-04-30,TERESINA,Gasolina,R$/l,2020-04-26,2020-05-02,PIAUI,2211001,"AVENIDA PREF. WALL FERRAZ, 7420, Triunfo, TERESINA, PIAUI, BRAZIL",-42.7942686,-5.126456,498837.57725781255,195720.3942182419,4929.4482272761215,755055.0708359422,1759709.2182186702,733409.3450270445,504439.51765561657,3133659.9061242347
607,POSTO SANTA ROSA LTDA,"AVENIDA DOUTOR MANOEL AYRES NETO (CJ V V SOL), 5255 QUADRA: 19; L",Santo Antonio,IPIRANGA,3.989,NA,"NA","NA",2020-04-29,TERESINA,Gasolina,R$/l,2020-04-26,2020-05-02,PIAUI,2211001,"AVENIDA DOUTOR MANOEL AYRES NETO (CJ V V SOL), 5255 QUADRA: 19; L, Santo Antonio, TERESINA, PIAUI, BRAZIL",-42.7527298,-5.144896699999999,499678.34292368335,195983.13420049343,5580.026291258682,760031.1554817881,1757922.3229299986,734864.6066259657,500687.8970797822,3133050.0631220103
608,G E S NOGUEIRA LIMA COMBUSTIVEIS LTDA - EPP,"AVENIDA JOSE SANTOS E SILVA, 551A",Centro,BRANCA,3.99,NA,"NA","NA",2020-04-29,TERESINA,Gasolina,R$/l,2020-04-26,2020-05-02,PIAUI,2211001,"AVENIDA JOSE SANTOS E SILVA, 551A, Centro, TERESINA, PIAUI, BRAZIL",-42.8158452,-5.0966092,497938.3513747463,195420.67650881788,5927.884556592762,751256.9036621534,1762257.8434709231,733238.516564193,505724.60190106754,3136124.6093677836
609,REDE MV COMBUSTIVEL LTDA,"AVENIDA BARAO DE GURGUEIA, 2403",Vermelha,IPIRANGA,3.99,NA,"NA","NA",2020-04-30,TERESINA,Gasolina,R$/l,2020-04-26,2020-05-02,PIAUI,2211001,"AVENIDA BARAO DE GURGUEIA, 2403, Vermelha, TERESINA, PIAUI, BRAZIL",-42.8061449,-5.1119802,498375.42842701694,195596.4082952397,5186.532756707802,753081.0061283216,1760955.6166526817,733259.1296673203,505208.28350117063,3134809.530045453
610,COMERCIO CARVALHO LTDA,"AVENIDA NACOES UNIDAS, 686",Vermelha,PETROBRAS DISTRIBUIDORA S.A.,3.999,NA,"NA","NA",2020-04-29,TERESINA,Gasolina,R$/l,2020-04-26,2020-05-02,PIAUI,2211001,"AVENIDA NACOES UNIDAS, 686, Vermelha, TERESINA, PIAUI, BRAZIL",-42.811659,-5.107444,498242.7640545347,195487.1233150751,5622.741851261307,752295.382871552,1761360.533318486,733126.4575405667,505640.26990726864,3135112.340615667
611,SHALOM DERIVADOS DE PETRÓLEO LTDA.,"RUA LOURENÇO VIEIRA DA SILVA, 18",Jardim Sao Cristovao Ii,BRANCA,3.689,NA,"NA","NA",2020-04-28,SAO LUIS,Gasolina,R$/l,2020-04-26,2020-05-02,MARANHAO,2111300,"RUA LOURENÇO VIEIRA DA SILVA, 18, Jardim Sao Cristovao Ii, SAO LUIS, MARANHAO, BRAZIL",-44.2255869,-2.5676449,451378.28005591274,254386.86582400286,15259.594156074101,867872.195860061,1989960.9493777542,736460.5506958783,652240.1895952194,3365515.1167897703
612,NICOLAU DERIVADOS DE PETROLEO LTDA,"UNIDADE DUZENTOS E TRES, 6000",Cidade Operaria,BRANCA,3.699,NA,"NA","NA",2020-04-28,SAO LUIS,Gasolina,R$/l,2020-04-26,2020-05-02,MARANHAO,2111300,"UNIDADE DUZENTOS E TRES, 6000, Cidade Operaria, SAO LUIS, MARANHAO, BRAZIL",-44.203902,-2.5739623,451843.5536288756,252975.7364237246,17659.39677537591,866114.8605148684,1989136.2373229659,737180.869204527,649738.1322771371,3365392.2502511865
613,ANTONIA LIANE GOMES SOARES,"AVENIDA LOURENCO VIEIRA DA SILVA, 8 QUADRA 44-A",Jardim Sao Cristovao Ii,BRANCA,3.699,NA,"NA","NA",2020-04-28,SAO LUIS,Gasolina,R$/l,2020-04-26,2020-05-02,MARANHAO,2111300,"AVENIDA LOURENCO VIEIRA DA SILVA, 8 QUADRA 44-A, Jardim Sao Cristovao Ii, SAO LUIS, MARANHAO, BRAZIL",-44.2251911,-2.5680201,451380.26081120543,254357.6912545348,15301.993186740578,867814.7902515024,1989922.9989313337,736467.5983497733,652188.8334677869,3365484.89586915
614,PORTOS EMPREENDIMENTOS LTDA - EPP,"AVENIDA ENGENHEIRO EMILIANO MACIEIRA, 1000 KM 12 BR 135",Pedrinhas,IPIRANGA,3.759,NA,"NA","NA",2020-04-28,SAO LUIS,Gasolina,R$/l,2020-04-26,2020-05-02,MARANHAO,2111300,"AVENIDA ENGENHEIRO EMILIANO MACIEIRA, 1000 KM 12 BR 135, Pedrinhas, SAO LUIS, MARANHAO, BRAZIL",-44.3081972,-2.6421134,448028.1540595049,257230.13005512313,9648.52211054102,865064.9382917569,1984459.604468889,731398.1402823273,659688.9592645306,3355390.7520585726
615,PEREIRA & DUARTE LTDA,"AVENIDA DOS HOLANDESES, 18 LOJA: 05;",Calhau,PETROBRAS DISTRIBUIDORA S.A.,3.799,NA,"NA","NA",2020-04-27,SAO LUIS,Gasolina,R$/l,2020-04-26,2020-05-02,MARANHAO,2111300,"AVENIDA DOS HOLANDESES, 18 LOJA: 05;, Calhau, SAO LUIS, MARANHAO, BRAZIL",-44.2673139,-2.4938844,452608.0941750863,257018.75101563288,13757.050660802568,877253.6630779861,1996982.25415967,736519.7839835522,658441.1871360607,3372386.908742313
616,POSTO AMERICANO LTDA,"VILA MARANHAO, 800",Maracana,IPIRANGA,3.799,NA,"NA","NA",2020-04-28,SAO LUIS,Gasolina,R$/l,2020-04-26,2020-05-02,MARANHAO,2111300,"VILA MARANHAO, 800, Maracana, SAO LUIS, MARANHAO, BRAZIL",-44.31715029999999,-2.6207123,447976.7820139946,258591.64757190237,7261.418058298393,867616.8754241924,1986452.799123557,731550.2086159239,661104.9833659987,3357466.9589613886
617,C N M COMERCIO DE COMBUSTIVEIS LTDA,"RUA NOSSA SENHORA DA LUZ, 01",Anil,BRANCA,3.8,NA,"NA","NA",2020-04-28,SAO LUIS,Gasolina,R$/l,2020-04-26,2020-05-02,MARANHAO,2111300,"RUA NOSSA SENHORA DA LUZ, 01, Anil, SAO LUIS, MARANHAO, BRAZIL",-44.2344599,-2.5496764,451601.11373254226,255120.7431606151,14494.390520243278,870089.391690716,1991653.6724537502,736526.3179138042,653603.0199923216,3367221.2148117432
618,PINTO DA COSTA COMERCIO EIRELI,"AVENIDA SAO SEBASTIAO, 460",Cruzeiro do Anil,BRANCA,3.8,NA,"NA","NA",2020-04-28,SAO LUIS,Gasolina,R$/l,2020-04-26,2020-05-02,MARANHAO,2111300,"AVENIDA SAO SEBASTIAO, 460, Cruzeiro do Anil, SAO LUIS, MARANHAO, BRAZIL",-44.23339,-2.543558,451805.65961986687,255100.98988326115,14746.498699526048,870628.6190830513,1992179.3856843528,736712.0181238904,653622.4904012844,3367906.9858143697
619,J. H.H NICOLAU - ME,"RUA FREI HERMENEGILDO, 01 SALA 01",Anil,PETROBRAS DISTRIBUIDORA S.A.,3.8,NA,"NA","NA",2020-04-28,SAO LUIS,Gasolina,R$/l,2020-04-26,2020-05-02,MARANHAO,2111300,"RUA FREI HERMENEGILDO, 01 SALA 01, Anil, SAO LUIS, MARANHAO, BRAZIL",-44.2355528,-2.5477662,451624.35965852457,255202.21680425902,14414.398048378182,870332.9928272561,1991835.5437244787,736527.3346353678,653764.4773039869,3367398.788053014
620,POSTO ROFE LTDA,"AVENIDA SAO LUIS REI DE FRANCA, 19 LOJA: 2A, BAIRRO TURU;",Cruzeiro do Anil,SABBÁ,3.809,NA,"NA","NA",2020-04-28,SAO LUIS,Gasolina,R$/l,2020-04-26,2020-05-02,MARANHAO,2111300,"AVENIDA SAO LUIS REI DE FRANCA, 19 LOJA: 2A, BAIRRO TURU;, Cruzeiro do Anil, SAO LUIS, MARANHAO, BRAZIL",-44.2264257,-2.5255903,452543.2796492458,254768.11523981002,16039.53372839419,872012.4643773036,1993676.6206940801,737409.016207839,653267.7199706635,3370018.7343905624
621,ROMA TRUCK CENTER LTDA,"RODOVIA BR 135(AVN. EMILIANO MACIEIRA) KM 06 LOJA A, 55 MARACANA",Maracana,BRANCA,3.829,NA,"NA","NA",2020-04-28,SAO LUIS,Gasolina,R$/l,2020-04-26,2020-05-02,MARANHAO,2111300,"RODOVIA BR 135(AVN. EMILIANO MACIEIRA) KM 06 LOJA A, 55 MARACANA, Maracana, SAO LUIS, MARANHAO, BRAZIL",-44.3138815,-2.6316094,447973.4515893654,257966.39507556343,8364.472039609434,866387.2359252757,1985454.3005730957,731421.2987094532,660524.0743622549,3356376.9225330106
622,POSTO JOYCE III EIRELI - EPP,"AVENIDA DOS FRANCESES, 220",Tirirical,RAIZEN,3.829,NA,"NA","NA",2020-04-28,SAO LUIS,Gasolina,R$/l,2020-04-26,2020-05-02,MARANHAO,2111300,"AVENIDA DOS FRANCESES, 220, Tirirical, SAO LUIS, MARANHAO, BRAZIL",-44.268131,-2.5388313,450994.11444455775,257217.93778431515,11178.546371490922,872925.7240117635,1993030.1289379457,735437.348012886,657512.1636375079,3367528.1847347748
623,ALCANTARA DERIVADOS DE PETROLEO E SERVIÇOS LTDA,"RODOVIA BR 135, S/N KM 23",Tibiri,PETROBRAS DISTRIBUIDORA S.A.,3.829,NA,"NA","NA",2020-04-28,SAO LUIS,Gasolina,R$/l,2020-04-26,2020-05-02,MARANHAO,2111300,"RODOVIA BR 135, S/N KM 23, Tibiri, SAO LUIS, MARANHAO, BRAZIL",-44.2480327,-2.607921,449899.85730685183,254999.10811491034,13319.785592751889,865146.8883472515,1986698.2458538848,734615.7793393007,653823.439774806,3360606.23636889
624,KRUK E LOPES LTDA,"AVENIDA ENGENHEIRO EMILIANO MACIEIRA, 13 : A; KM: 3;",Tibiri,SABBÁ,3.829,NA,"NA","NA",2020-04-28,SAO LUIS,Gasolina,R$/l,2020-04-26,2020-05-02,MARANHAO,2111300,"AVENIDA ENGENHEIRO EMILIANO MACIEIRA, 13 : A; KM: 3;, Tibiri, SAO LUIS, MARANHAO, BRAZIL",-44.3081972,-2.6421134,448028.1540595049,257230.13005512313,9648.52211054102,865064.9382917569,1984459.604468889,731398.1402823273,659688.9592645306,3355390.7520585726
625,POSTO MAGNOLIA LTDA,"RODOVIA BR 135, S/N KM 8,5",Maracanã,PETROBRAS DISTRIBUIDORA S.A.,3.849,NA,"NA","NA",2020-04-28,SAO LUIS,Gasolina,R$/l,2020-04-26,2020-05-02,MARANHAO,2111300,"RODOVIA BR 135, S/N KM 8,5, Maracanã, SAO LUIS, MARANHAO, BRAZIL",-44.2648085,-2.6309423,449124.07226942404,255317.84001555567,12625.313541711219,863810.0094722048,1984887.1789147223,733399.6836465416,655175.5527350093,3357699.7030249806
626,P LIMA COMBUSTIVEIS LTDA,"AVENIDA ENGENHEIRO EMILIANO MACIEIRA, 55 LOJA: 31; : 1 PAVIMENTO;",Pedrinhas,IPIRANGA,3.849,NA,"NA","NA",2020-04-28,SAO LUIS,Gasolina,R$/l,2020-04-26,2020-05-02,MARANHAO,2111300,"AVENIDA ENGENHEIRO EMILIANO MACIEIRA, 55 LOJA: 31; : 1 PAVIMENTO;, Pedrinhas, SAO LUIS, MARANHAO, BRAZIL",-44.3202394,-2.6164293,447941.4157072405,258929.24044345593,6690.073726021986,868197.753759733,1986868.5443480136,731528.8724209621,661530.9247525956,3357849.6049699318
627,POSTO MAGNOLIA LTDA,"RODOVIA BR 135, S/N KM 13",Pedrinhas,IPIRANGA,3.849,NA,"NA","NA",2020-04-28,SAO LUIS,Gasolina,R$/l,2020-04-26,2020-05-02,MARANHAO,2111300,"RODOVIA BR 135, S/N KM 13, Pedrinhas, SAO LUIS, MARANHAO, BRAZIL",-44.24200219999999,-2.580716,450603.5245353738,255200.2574931256,13448.421601231006,867469.0859844474,1989015.117406303,735497.4845917239,653745.9241131007,3363688.0582772833
628,PIT STOP DERIVADOS DE PETROLEO LTDA,"AVENIDA EDSON BRANDAO, 10",Anil,SABBÁ,3.85,NA,"NA","NA",2020-04-28,SAO LUIS,Gasolina,R$/l,2020-04-26,2020-05-02,MARANHAO,2111300,"AVENIDA EDSON BRANDAO, 10, Anil, SAO LUIS, MARANHAO, BRAZIL",-44.2513186,-2.550736,451099.412303864,256139.93857701923,12630.706954042476,870877.3462620601,1991770.7132227414,735828.6138961383,655416.4703962108,3366676.0037754676
629,POSTOS REALEZA EIRELI,"TRAVESSA SANTA TEREZA, 689",Cutim Anil,BRANCA,3.85,NA,"NA","NA",2020-04-28,SAO LUIS,Gasolina,R$/l,2020-04-26,2020-05-02,MARANHAO,2111300,"TRAVESSA SANTA TEREZA, 689, Cutim Anil, SAO LUIS, MARANHAO, BRAZIL",-44.2495495,-2.5517464,451120.28034516884,256024.098841663,12802.609785912828,870685.4331645872,1991659.5971286837,735875.5319054641,655201.3749639418,3366612.474506988
630,J R EQUIPAMENTOS PARA COMUNICACAO EIRELI,"AVENIDA DOS FRANCESES, 36 B",Santo Antonio,PETROBRAS DISTRIBUIDORA S.A.,3.85,NA,"NA","NA",2020-04-28,SAO LUIS,Gasolina,R$/l,2020-04-26,2020-05-02,MARANHAO,2111300,"AVENIDA DOS FRANCESES, 36 B, Santo Antonio, SAO LUIS, MARANHAO, BRAZIL",-44.24715579999999,-2.5601841,450957.54012848245,255799.37564869583,12928.232579041467,869738.211854463,1990886.67525901,735773.3644266693,654754.7604522445,3365765.640356173
631,POSTO DE SERVICOS J. M. LTDA.,"AVENIDA CASEMIRO JUNIOR, 200 A",Anil,BRANCA,3.85,NA,"NA","NA",2020-04-28,SAO LUIS,Gasolina,R$/l,2020-04-26,2020-05-02,MARANHAO,2111300,"AVENIDA CASEMIRO JUNIOR, 200 A, Anil, SAO LUIS, MARANHAO, BRAZIL",-44.2420211,-2.5504714,451366.7878023573,255574.79228760535,13651.489928067225,870411.2735043181,1991677.851016582,736205.836642227,654409.2375083957,3366942.170310891
632,LIMA COMERCIAL DE COMBUSTIVEIS LTDA,"AVENIDA DOS FRANCESES, 25",Tirirical,SABBÁ,3.859,NA,"NA","NA",2020-04-28,SAO LUIS,Gasolina,R$/l,2020-04-26,2020-05-02,MARANHAO,2111300,"AVENIDA DOS FRANCESES, 25, Tirirical, SAO LUIS, MARANHAO, BRAZIL",-44.2473795,-2.5601618,450951.81845419726,255813.36104709576,12903.781269191939,869752.2271539944,1990891.436295772,735764.9553475488,654779.6325410395,3365762.3200999848
633,C. G. DE SOUSA EIRELI,"AVENIDA GUAJAJARA, 205",Sao Cristovao,PETROBRAS DISTRIBUIDORA S.A.,3.859,NA,"NA","NA",2020-04-27,SAO LUIS,Gasolina,R$/l,2020-04-26,2020-05-02,MARANHAO,2111300,"AVENIDA GUAJAJARA, 205, Sao Cristovao, SAO LUIS, MARANHAO, BRAZIL",-44.22646280000001,-2.5614787,451509.3522916443,254516.45276642955,15204.721108052703,868518.6417690432,1990514.7715092425,736569.8377599544,652470.9407252247,3366156.1296600946
634,CARONE COMBUSTIVEIS LTDA,"AVENIDA DOS FRANCESES, 200 LOJA A",Santo Antonio,BRANCA,3.859,NA,"NA","NA",2020-04-28,SAO LUIS,Gasolina,R$/l,2020-04-26,2020-05-02,MARANHAO,2111300,"AVENIDA DOS FRANCESES, 200 LOJA A, Santo Antonio, SAO LUIS, MARANHAO, BRAZIL",-44.2466399,-2.5614753,450938.1858097959,255753.7483107396,12970.315849815915,869585.3426545094,1990766.5439677055,735763.6946765638,654670.2095870596,3365639.8822934167
635,LIMA COMERCIAL DE COMBUSTIVEIS LTDA,"AVENIDA ENGENHEIRO EMILIANO MACIEIRA, 215 KM: 06;",Maracana,SABBÁ,3.859,NA,"NA","NA",2020-04-28,SAO LUIS,Gasolina,R$/l,2020-04-26,2020-05-02,MARANHAO,2111300,"AVENIDA ENGENHEIRO EMILIANO MACIEIRA, 215 KM: 06;, Maracana, SAO LUIS, MARANHAO, BRAZIL",-44.3081972,-2.6421134,448028.1540595049,257230.13005512313,9648.52211054102,865064.9382917569,1984459.604468889,731398.1402823273,659688.9592645306,3355390.7520585726
636,L S COMERCIO E SERVICOS LTDA,"AVENIDA DOS FRANCESES, 3",Santo Antonio,SABBÁ,3.859,NA,"NA","NA",2020-04-28,SAO LUIS,Gasolina,R$/l,2020-04-26,2020-05-02,MARANHAO,2111300,"AVENIDA DOS FRANCESES, 3, Santo Antonio, SAO LUIS, MARANHAO, BRAZIL",-44.249937,-2.555852,450995.6085654658,256012.827806119,12684.061464769453,870306.7269104905,1991302.9032282415,735763.8789916832,655153.0876083815,3366160.739468339
637,POSTO PINGUIM LTDA - ME,"AVENIDA SANTOS DUMONT, 66 A",Sao Cristovao,ALESAT,3.859,NA,"NA","NA",2020-04-27,SAO LUIS,Gasolina,R$/l,2020-04-26,2020-05-02,MARANHAO,2111300,"AVENIDA SANTOS DUMONT, 66 A, Sao Cristovao, SAO LUIS, MARANHAO, BRAZIL",-44.238757,-2.560944300000001,451174.8580477154,255275.4078378081,13848.495667977917,869219.856143665,1990714.8505632745,736090.9932257839,653822.6385805706,3365898.7067151438
639,MERCADINHO CARONE LTDA.,"AVENIDA SAO LUIS REI DE FRANCA, 01 AREA E1-B LOTEAMENTO OLHO DAGU",Olho Dagua,PETROBRAS DISTRIBUIDORA S.A.,3.87,NA,"NA","NA",2020-04-27,SAO LUIS,Gasolina,R$/l,2020-04-26,2020-05-02,MARANHAO,2111300,"AVENIDA SAO LUIS REI DE FRANCA, 01 AREA E1-B LOTEAMENTO OLHO DAGU, Olho Dagua, SAO LUIS, MARANHAO, BRAZIL",-44.2248793,-2.4784841,454215.8708551974,254607.17500614506,18557.569167889418,876526.2001663003,1997814.2751424757,738564.1786519449,654185.7124255364,3375127.332666163
640,MERCADINHO CARONE LTDA.,"AVENIDA SÃO LUÍS REI DE FRANÇA, 100",Turú,PETROBRAS DISTRIBUIDORA S.A.,3.87,NA,"NA","NA",2020-04-28,SAO LUIS,Gasolina,R$/l,2020-04-26,2020-05-02,MARANHAO,2111300,"AVENIDA SÃO LUÍS REI DE FRANÇA, 100, Turú, SAO LUIS, MARANHAO, BRAZIL",-44.226299,-2.508874,453094.4936437206,254779.91834097754,16749.232691481473,873635.4738006537,1995149.3546277452,737802.9256909059,653634.8091079204,3371820.7560760453
641,POSTO ELDORADO LTDA,"AVENIDA SAO LUIS REI DE FRANCA, L. JD.ELDORAD, 01 LOTE 01 E 15 QD",Turu,PETROBRAS DISTRIBUIDORA S.A.,3.87,NA,"NA","NA",2020-04-28,SAO LUIS,Gasolina,R$/l,2020-04-26,2020-05-02,MARANHAO,2111300,"AVENIDA SAO LUIS REI DE FRANCA, L. JD.ELDORAD, 01 LOTE 01 E 15 QD, Turu, SAO LUIS, MARANHAO, BRAZIL",-44.22567919999999,-2.5309335,452397.15921303513,254705.04748380085,15935.16336994946,871452.5098400767,1993196.305910516,737314.335668444,653065.7539834813,3369462.9036936904
642,M G COMERCIO DE COMBUSTIVEIS LTDA - ME,"AVENIDA SAO LUIS REI DE FRANCA, 48",Turu,IPIRANGA,3.87,NA,"NA","NA",2020-04-28,SAO LUIS,Gasolina,R$/l,2020-04-26,2020-05-02,MARANHAO,2111300,"AVENIDA SAO LUIS REI DE FRANCA, 48, Turu, SAO LUIS, MARANHAO, BRAZIL",-44.22600910000001,-2.5211777,452695.37768699176,254754.2043841166,16249.277849729278,872420.686399396,1994060.5513137456,737528.3616217775,653322.431371645,3370504.220784862
643,C R POSTO DE GASOLINA LTDA,"AVENIDA ITAPIRACO, 01 LOTEAMENTO ITAPIRACO",Anil,SABBÁ,3.879,NA,"NA","NA",2020-04-27,SAO LUIS,Gasolina,R$/l,2020-04-26,2020-05-02,MARANHAO,2111300,"AVENIDA ITAPIRACO, 01 LOTEAMENTO ITAPIRACO, Anil, SAO LUIS, MARANHAO, BRAZIL",-44.209423,-2.5294979,452890.59675386106,253742.51939120953,17714.353459617712,870739.6496249358,1993122.0522226864,737996.841877743,651328.4100574653,3370034.173058011
