StationID,RzSocial,Endereco,Bairro,Bandeira,PcVenda,PcCompra,ModCompra,Fornecedor,DtColeta,Cidade,Produto,UnidMedida,DtInicial,DtFinal,Estado,CodIBGE,Place,Lon,Lat,DistMean,DistDev,DistMin,DistMax,RefinMean,RefinDev,RefinMin,RefinMax
937,COMERCIO DE COMBUSTIVEIS E LUBRIFICANTES SANTA MONICA LTDA.,"RUA CORONEL PEDRO DEMORO, 2035",Estreito,RAIZEN MIME,3.799,NA,"NA","NA",2020-04-30,FLORIANOPOLIS,Gasolina,R$/l,2020-04-26,2020-05-02,SANTA CATARINA,4205407,"RUA CORONEL PEDRO DEMORO, 2035, Estreito, FLORIANOPOLIS, SANTA CATARINA, BRAZIL",-48.5846256,-27.5824965,155432.8189641826,65830.20755791763,58464.27239735151,237164.5855534002,1301367.0403471068,986153.4909129445,237441.85273677367,2962753.566076464
938,AUTO POSTO NOVO CAMPECHE LTDA.,"RODOVIA DR. ANTONIO LUIZ MOURA GONZAGA, 3043",Rio Tavares,ALESAT,3.799,NA,"NA","NA",2020-04-30,FLORIANOPOLIS,Gasolina,R$/l,2020-04-26,2020-05-02,SANTA CATARINA,4205407,"RODOVIA DR. ANTONIO LUIZ MOURA GONZAGA, 3043, Rio Tavares, FLORIANOPOLIS, SANTA CATARINA, BRAZIL",-48.4839686,-27.6562392,164235.5078486187,66885.33164320934,70421.57915994056,248227.4203143887,1304127.4617173877,986718.7086629499,248532.858802725,2974466.99705546
939,AUTO POSTO DE ABASTECIMENTO E SERVICOS 5 ESTRELAS LTDA,"RUA DEPUTADO ANTONIO EDU VIEIRA, 393",Pantanal,PETROBRAS DISTRIBUIDORA S.A.,3.799,NA,"NA","NA",2020-04-30,FLORIANOPOLIS,Gasolina,R$/l,2020-04-26,2020-05-02,SANTA CATARINA,4205407,"RUA DEPUTADO ANTONIO EDU VIEIRA, 393, Pantanal, FLORIANOPOLIS, SANTA CATARINA, BRAZIL",-48.5246823,-27.6108224,159649.70587243428,66302.99348510994,64044.546619081964,242108.8467333549,1301860.2668104053,986209.7051325856,242405.7986041656,2968177.4146533073
940,VILA RICA COM DE COMBUSTIVEL LTDA,"AVENIDA MAURO RAMOS, 390 TERREO",Centro,IPIRANGA,3.799,NA,"NA","NA",2020-04-30,FLORIANOPOLIS,Gasolina,R$/l,2020-04-26,2020-05-02,SANTA CATARINA,4205407,"AVENIDA MAURO RAMOS, 390 TERREO, Centro, FLORIANOPOLIS, SANTA CATARINA, BRAZIL",-48.544495,-27.5980117,158022.0125408518,66124.19100915246,61841.94941558557,240105.61377187519,1301442.3282166757,986129.3867152379,240396.72939170478,2966040.996409708
941,AUTO POSTO DA VOVO LTDA.,"RUA LAURO LINHARES, 1619",Trindade,IPIRANGA,3.799,NA,"NA","NA",2020-04-30,FLORIANOPOLIS,Gasolina,R$/l,2020-04-26,2020-05-02,SANTA CATARINA,4205407,"RUA LAURO LINHARES, 1619, Trindade, FLORIANOPOLIS, SANTA CATARINA, BRAZIL",-48.52129499999999,-27.593096,158707.24632469614,66167.00858056605,62527.61262966027,240382.4840493183,1300493.9543749522,985851.4035561172,240683.75272681392,2966562.1941127684
942,AUTO POSTO TORNEG LTDA - EPP,"RODOVIA JOAO GUALBERTO SOARES, 1221",Ingleses,BRANCA,3.849,NA,"NA","NA",2020-04-29,FLORIANOPOLIS,Gasolina,R$/l,2020-04-26,2020-05-02,SANTA CATARINA,4205407,"RODOVIA JOAO GUALBERTO SOARES, 1221, Ingleses, FLORIANOPOLIS, SANTA CATARINA, BRAZIL",-48.4041147,-27.4505108,156002.1030881955,66061.17867446727,57967.09735798684,230202.89766385124,1287262.485474852,982284.0713299557,230577.57901698386,2957550.023552328
943,POSTO RIO VERMELHO LTDA,"RODOVIA SC 403, S/N KM 3",Vargem do Bom Jesus,PETROBRAS DISTRIBUIDORA S.A.,3.859,NA,"NA","NA",2020-04-29,FLORIANOPOLIS,Gasolina,R$/l,2020-04-26,2020-05-02,SANTA CATARINA,4205407,"RODOVIA SC 403, S/N KM 3, Vargem do Bom Jesus, FLORIANOPOLIS, SANTA CATARINA, BRAZIL",-48.4212737,-27.4453106,154813.69664883614,66074.12488259297,56305.63881183029,228977.88462050614,1287316.8240407323,982326.4815399739,229346.77674448027,2956276.4647249994
944,A. ANGELONI & CIA. LTDA,"AVENIDA IRINEU BORNHAUSEN, 5188",Agronomica,RAIZEN MIME,3.898,NA,"NA","NA",2020-04-30,FLORIANOPOLIS,Gasolina,R$/l,2020-04-26,2020-05-02,SANTA CATARINA,4205407,"AVENIDA IRINEU BORNHAUSEN, 5188, Agronomica, FLORIANOPOLIS, SANTA CATARINA, BRAZIL",-48.5278669,-27.5742849,157274.95060980227,66015.72587014358,60412.145334223365,238202.58296402992,1299305.274301471,985552.9692615616,238504.39256930738,2964405.331497824
945,POSTO DE COMBUSTIVEIS HELIX EIRELI,"RODOVIA SC 401, 4290",Saco Grande,RAIZEN MIME,3.898,NA,"NA","NA",2020-04-30,FLORIANOPOLIS,Gasolina,R$/l,2020-04-26,2020-05-02,SANTA CATARINA,4205407,"RODOVIA SC 401, 4290, Saco Grande, FLORIANOPOLIS, SANTA CATARINA, BRAZIL",-48.51001489999999,-27.5356933,155732.03139026056,65899.54936253763,57832.241353059966,234832.4705393528,1296068.749559261,984692.5806163647,235148.2429789188,2961348.6273667198
946,POSTO GALO LTDA,"RUA ALMIRANTE LAMENGO, 1076",Centro,IPIRANGA,3.899,NA,"NA","NA",2020-04-30,FLORIANOPOLIS,Gasolina,R$/l,2020-04-26,2020-05-02,SANTA CATARINA,4205407,"RUA ALMIRANTE LAMENGO, 1076, Centro, FLORIANOPOLIS, SANTA CATARINA, BRAZIL",-48.5575401,-27.589192100000002,156937.75630560977,66003.13334811138,60363.26605483568,238750.739736925,1301143.3570269765,986067.4724455603,239038.01602562558,2964596.3151233494
947,POSTO GALO LTDA,"AVENIDA AFONSO DELAMBERT NETO, 240",Lagoa da Conceição,IPIRANGA,3.899,NA,"NA","NA",2020-04-30,FLORIANOPOLIS,Gasolina,R$/l,2020-04-26,2020-05-02,SANTA CATARINA,4205407,"AVENIDA AFONSO DELAMBERT NETO, 240, Lagoa da Conceição, FLORIANOPOLIS, SANTA CATARINA, BRAZIL",-48.4719759,-27.6029733,161511.72592886767,66374.2631117606,66093.67547448819,243143.44723388538,1299965.1968533848,985631.7947990183,243462.56450260745,2969696.659353569
948,AUTO POSTO CHIARELLO COMERCIO DE COMBUSTIVEIS LTDA,"AVENIDA DAS RAIAS, 261",Jurere Internacional,RAIZEN MIME,3.899,NA,"NA","NA",2020-04-29,FLORIANOPOLIS,Gasolina,R$/l,2020-04-26,2020-05-02,SANTA CATARINA,4205407,"AVENIDA DAS RAIAS, 261, Jurere Internacional, FLORIANOPOLIS, SANTA CATARINA, BRAZIL",-48.5021962,-27.4464729,150861.0100194478,65960.21950541927,50644.755107603065,225936.5710223046,1289464.3111444262,982977.4962744092,226272.11764407993,2952829.011502381
949,AUTO POSTO INGLESES LTDA,"RODOVIA SC 403 - KM 5, 5105",Ingleses,IPIRANGA,3.899,NA,"NA","NA",2020-04-29,FLORIANOPOLIS,Gasolina,R$/l,2020-04-26,2020-05-02,SANTA CATARINA,4205407,"RODOVIA SC 403 - KM 5, 5105, Ingleses, FLORIANOPOLIS, SANTA CATARINA, BRAZIL",-48.4052836,-27.4378043,155241.02350720804,66097.2517407465,56975.40782350436,228874.60859722111,1286376.943277042,982062.5553108262,229251.43567245253,2956238.96705589
950,POSTO CORREGO GRANDE LTDA,"RUA JOAO PIO DUARTE SILVA, 298",Corrego Grande,IPIRANGA,3.999,NA,"NA","NA",2020-04-30,FLORIANOPOLIS,Gasolina,R$/l,2020-04-26,2020-05-02,SANTA CATARINA,4205407,"RUA JOAO PIO DUARTE SILVA, 298, Corrego Grande, FLORIANOPOLIS, SANTA CATARINA, BRAZIL",-48.5136571,-27.6008925,159516.40064032408,66252.18047299098,63658.04313868612,241455.55505035815,1300862.7729256358,985935.0131250889,241758.562469388,2967670.2926924326
951,SULCAR POSTO DE SERVICOS LTDA,"RUA DEP ANTONIO EDU VIEIRA, 1190",Pantanal,IPIRANGA,3.999,NA,"NA","NA",2020-04-30,FLORIANOPOLIS,Gasolina,R$/l,2020-04-26,2020-05-02,SANTA CATARINA,4205407,"RUA DEP ANTONIO EDU VIEIRA, 1190, Pantanal, FLORIANOPOLIS, SANTA CATARINA, BRAZIL",-48.5185781,-27.6065324,159648.5520297863,66284.39944694942,63941.03480860301,241871.59767781178,1301395.1660223093,986080.1057322574,242171.69752105162,2968016.637328458
952,POSTO AVIAO LTDA,"RUA DEP DIOMICIO FREITAS, SN",Carianos,IPIRANGA,3.999,NA,"NA","NA",2020-04-30,FLORIANOPOLIS,Gasolina,R$/l,2020-04-26,2020-05-02,SANTA CATARINA,4205407,"RUA DEP DIOMICIO FREITAS, SN, Carianos, FLORIANOPOLIS, SANTA CATARINA, BRAZIL",-48.5347161,-27.6633178,162490.64792189532,66853.8528481483,68679.79018194148,247245.02251740897,1305912.6817241705,987274.1750239724,247529.51748925584,2972963.498534156
953,COLONIAL PRODUTOS E SERVICOS LTDA,"AVENIDA MAURO RAMOS, 2010",Centro,IPIRANGA,4.099,NA,"NA","NA",2020-04-30,FLORIANOPOLIS,Gasolina,R$/l,2020-04-26,2020-05-02,SANTA CATARINA,4205407,"AVENIDA MAURO RAMOS, 2010, Centro, FLORIANOPOLIS, SANTA CATARINA, BRAZIL",-48.5444106,-27.583972,157162.5238471713,66018.0665228133,60493.665154197166,238645.67636169094,1300428.3901023294,985865.6227303179,238939.15239402442,2964648.109070646
954,COMERCIO DE COMBUSTIVEIS LUMBRAX LTDA,"AVENIDA CORONEL APARICIO BORGES, 1048",Gloria,IDAZA,3.749,NA,"NA","NA",2020-04-27,PORTO ALEGRE,Gasolina,R$/l,2020-04-26,2020-05-02,RIO GRANDE DO SUL,4314902,"AVENIDA CORONEL APARICIO BORGES, 1048, Gloria, PORTO ALEGRE, RIO GRANDE DO SUL, BRAZIL",-51.1978041,-30.072826,153469.7528051975,113140.66231640792,22811.056716037456,280649.0405310481,1562565.211552993,1068690.4619741403,22649.61186669651,3210055.56029352
955,CAMPUS NONOAI COMERCIO DE COMBUSTIVEIS LTDA,"AVENIDA NONOAI, 1234",Nonoai,PETROBRAS DISTRIBUIDORA S.A.,3.77,NA,"NA","NA",2020-04-27,PORTO ALEGRE,Gasolina,R$/l,2020-04-26,2020-05-02,RIO GRANDE DO SUL,4314902,"AVENIDA NONOAI, 1234, Nonoai, PORTO ALEGRE, RIO GRANDE DO SUL, BRAZIL",-51.2211082,-30.0918334,154876.17222770333,112635.09520735982,25109.191601947477,282525.00613341905,1565059.0519943845,1069032.5542946763,25165.112420856294,3212955.419069268
956,SIM REDE DE POSTOS LTDA,"AVENIDA IPIRANGA, 999",Praia de Belas,PETROBRAS DISTRIBUIDORA S.A.,3.779,NA,"NA","NA",2020-04-27,PORTO ALEGRE,Gasolina,R$/l,2020-04-26,2020-05-02,RIO GRANDE DO SUL,4314902,"AVENIDA IPIRANGA, 999, Praia de Belas, PORTO ALEGRE, RIO GRANDE DO SUL, BRAZIL",-51.2184506,-30.0485873,151232.23951082255,113483.89500793649,20326.121797721655,279316.144314093,1561485.2457544832,1068372.4149786478,20465.541723583323,3208573.3223341405
957,SIM REDE DE POSTOS LTDA,"RUA PROFESSOR CRISTIANO FISCHER, 1337",Petropolis,PETROBRAS DISTRIBUIDORA S.A.,3.779,NA,"NA","NA",2020-04-27,PORTO ALEGRE,Gasolina,R$/l,2020-04-26,2020-05-02,RIO GRANDE DO SUL,4314902,"RUA PROFESSOR CRISTIANO FISCHER, 1337, Petropolis, PORTO ALEGRE, RIO GRANDE DO SUL, BRAZIL",-51.1714691,-30.0520238,152055.32688221367,113618.6017744334,20434.74951184725,281560.09880502,1559814.6954397638,1068298.034432025,20073.45521344512,3206845.786880282
958,MOTTA PINHEIRO - COMERCIO DE COMBUSTIVEIS EIRELI,"AVENIDA DA CAVALHADA, 4260",Cavalhada,IPIRANGA,3.779,NA,"NA","NA",2020-04-27,PORTO ALEGRE,Gasolina,R$/l,2020-04-26,2020-05-02,RIO GRANDE DO SUL,4314902,"AVENIDA DA CAVALHADA, 4260, Cavalhada, PORTO ALEGRE, RIO GRANDE DO SUL, BRAZIL",-51.2261159,-30.1135026,156690.34013148447,112193.09042128945,27554.247494018015,284422.7305475424,1567005.6302570668,1069371.2676634635,27613.42654800246,3215313.143113902
959,MC BR COMERCIO DE COMBUSTIVEIS LTDA,"AVENIDA IPIRANGA, 5800",Petropolis,PETROBRAS DISTRIBUIDORA S.A.,3.779,NA,"NA","NA",2020-04-27,PORTO ALEGRE,Gasolina,R$/l,2020-04-26,2020-05-02,RIO GRANDE DO SUL,4314902,"AVENIDA IPIRANGA, 5800, Petropolis, PORTO ALEGRE, RIO GRANDE DO SUL, BRAZIL",-51.1813952,-30.0579521,152410.05863702955,113488.60902319192,21085.906572696167,281098.8701692435,1560695.7250365033,1068420.1621580482,20804.842891940538,3207866.834907408
960,SANTIAGO E IRIGARAY LTDA,"AVENIDA IPIRANGA, 435",Praia de Belas,IPIRANGA,3.779,NA,"NA","NA",2020-04-27,PORTO ALEGRE,Gasolina,R$/l,2020-04-26,2020-05-02,RIO GRANDE DO SUL,4314902,"AVENIDA IPIRANGA, 435, Praia de Belas, PORTO ALEGRE, RIO GRANDE DO SUL, BRAZIL",-51.2236347,-30.0486191,151201.19426786728,113438.40824718059,20409.83488260593,279709.6757143288,1561707.2913355315,1068380.9124420688,20613.57061320873,3208804.887895678
961,POSTO MACH COMERCIO DE COMBUSTIVEIS LTDA,"AVENIDA AZENHA, 355",Azenha,RODOIL,3.779,NA,"NA","NA",2020-04-27,PORTO ALEGRE,Gasolina,R$/l,2020-04-26,2020-05-02,RIO GRANDE DO SUL,4314902,"AVENIDA AZENHA, 355, Azenha, PORTO ALEGRE, RIO GRANDE DO SUL, BRAZIL",-51.2139889,-30.0469924,151130.77958915746,113550.20787292646,20091.36270157178,278869.4151476547,1561169.4413880378,1068340.5212671882,20179.32802249415,3208219.500906156
962,T P MOTA COMBUSTIVEIS - EPP,"AVENIDA IPIRANGA, 4672",Petropolis,RODOIL,3.779,NA,"NA","NA",2020-04-27,PORTO ALEGRE,Gasolina,R$/l,2020-04-26,2020-05-02,RIO GRANDE DO SUL,4314902,"AVENIDA IPIRANGA, 4672, Petropolis, PORTO ALEGRE, RIO GRANDE DO SUL, BRAZIL",-51.19171919999999,-30.053583,151907.396627173,113545.42801549126,20642.772546201522,279998.4431009237,1560768.904358893,1068387.3777442826,20450.594392214738,3207889.5149094197
963,JARDIM VERDE COMBUSTIVEIS LTDA,"ESTRADA EDUARDO PRADO, 1550",Ipanema,BRANCA,3.779,NA,"NA","NA",2020-04-27,PORTO ALEGRE,Gasolina,R$/l,2020-04-26,2020-05-02,RIO GRANDE DO SUL,4314902,"ESTRADA EDUARDO PRADO, 1550, Ipanema, PORTO ALEGRE, RIO GRANDE DO SUL, BRAZIL",-51.2179113,-30.1324382,158377.58155864844,111898.60141424327,29545.265247958738,285157.89665258006,1568184.827994875,1069636.9946227223,29497.446151697273,3216820.793438245
964,ABASTECEDORA DE COMBUSTIVEIS ZONA SUL LTDA,"AVENIDA CAVALHADA, 3696",Cavalhada,BRANCA,3.779,NA,"NA","NA",2020-04-27,PORTO ALEGRE,Gasolina,R$/l,2020-04-26,2020-05-02,RIO GRANDE DO SUL,4314902,"AVENIDA CAVALHADA, 3696, Cavalhada, PORTO ALEGRE, RIO GRANDE DO SUL, BRAZIL",-51.22700769999999,-30.1080866,156221.20984662592,112286.67524973166,26971.71647460292,284107.12048504,1566608.6367705602,1069291.148251139,27050.506987147917,3214818.1111250217
965,POSTO DE COMBUSTIVEL DA ROTULA LTDA,"AVENIDA CAVALHADA, 2490",Cavalhada,RODOIL,3.779,NA,"NA","NA",2020-04-27,PORTO ALEGRE,Gasolina,R$/l,2020-04-26,2020-05-02,RIO GRANDE DO SUL,4314902,"AVENIDA CAVALHADA, 2490, Cavalhada, PORTO ALEGRE, RIO GRANDE DO SUL, BRAZIL",-51.2313929,-30.098124,155343.89582472455,112435.9839058877,25945.257622841196,283733.9611942522,1565994.3811323692,1069148.519742603,26089.30992983877,3214028.402528496
966,ABASTECEDORA DE COMBUSTIVEIS RODEBENS LTDA,"AVENIDA BENTO GONCALVES, 2599",Partenon,BRANCA,3.779,NA,"NA","NA",2020-04-27,PORTO ALEGRE,Gasolina,R$/l,2020-04-26,2020-05-02,RIO GRANDE DO SUL,4314902,"AVENIDA BENTO GONCALVES, 2599, Partenon, PORTO ALEGRE, RIO GRANDE DO SUL, BRAZIL",-51.1892927,-30.0617934,152632.16101094594,113391.19180530561,21537.660774422977,280682.8886359162,1561328.2719891164,1068501.9694626494,21317.78669280486,3208592.9112099353
967,AUTO POSTO ELUMAI LTDA.,"AVENIDA IPIRANGA, 4610",Azenha,RAIZEN,3.779,NA,"NA","NA",2020-04-27,PORTO ALEGRE,Gasolina,R$/l,2020-04-26,2020-05-02,RIO GRANDE DO SUL,4314902,"AVENIDA IPIRANGA, 4610, Azenha, PORTO ALEGRE, RIO GRANDE DO SUL, BRAZIL",-51.1926319,-30.0530452,151851.0737856595,113552.62738963589,20589.246641879352,279892.1923282717,1560763.429792513,1068381.9686023884,20405.281867830596,3207876.5913996203
968,COMERCIAL BUFFON COMBUSTIVEIS E TRANSPORTES LIMITADA,"AVENIDA VICENTE MONTEGGIA, 131 ESQ AV CAVALHADA",Cavalhada,IPIRANGA,3.799,NA,"NA","NA",2020-04-27,PORTO ALEGRE,Gasolina,R$/l,2020-04-26,2020-05-02,RIO GRANDE DO SUL,4314902,"AVENIDA VICENTE MONTEGGIA, 131 ESQ AV CAVALHADA, Cavalhada, PORTO ALEGRE, RIO GRANDE DO SUL, BRAZIL",-51.2259093,-30.0957389,155175.23053056866,112525.15281801869,25601.968845540327,283157.32132183126,1565573.082674185,1069101.6460387202,25697.545535600366,3213551.861945448
969,COMERCIAL DE COMBUSTÍVEIS CAMPO ALEGRE LTDA.,"AVENIDA JUCA BATISTA, 630",Ipanema,PETROBRAS DISTRIBUIDORA S.A.,3.799,NA,"NA","NA",2020-04-27,PORTO ALEGRE,Gasolina,R$/l,2020-04-26,2020-05-02,RIO GRANDE DO SUL,4314902,"AVENIDA JUCA BATISTA, 630, Ipanema, PORTO ALEGRE, RIO GRANDE DO SUL, BRAZIL",-51.2207022,-30.1395814,158969.94639349869,111750.10716413416,30360.70454213933,285873.1182556668,1568874.2622347947,1069751.8836256776,30326.323387851113,3217648.1923671635
970,ORIGINAL PARKING -EIRELI ME,"AVENIDA BENTO GONÇALVES, 943",Partenon,IPIRANGA,3.799,NA,"NA","NA",2020-04-27,PORTO ALEGRE,Gasolina,R$/l,2020-04-26,2020-05-02,RIO GRANDE DO SUL,4314902,"AVENIDA BENTO GONÇALVES, 943, Partenon, PORTO ALEGRE, RIO GRANDE DO SUL, BRAZIL",-51.2036866,-30.0535169,151771.94188959606,113490.14220418218,20708.807396582415,279019.3463865017,1561260.1561958161,1068417.3293248597,20650.49845177643,3208409.425970445
971,AUTO POSTO SANTA MONICA LTDA - EPP,"AVENIDA JUCA BATISTA, 1060",Belem Novo,IPIRANGA,3.799,NA,"NA","NA",2020-04-27,PORTO ALEGRE,Gasolina,R$/l,2020-04-26,2020-05-02,RIO GRANDE DO SUL,4314902,"AVENIDA JUCA BATISTA, 1060, Belem Novo, PORTO ALEGRE, RIO GRANDE DO SUL, BRAZIL",-51.21785,-30.1422138,159220.11477020252,111719.33383882069,30623.083704670433,285850.96749189385,1568967.9926243564,1069783.8303623984,30560.735157367923,3217782.7276505562
972,COMERCIAL DE COMBUSTIVEIS PLANETARIO LTDA,"AVENIDA IPIRANGA, 1770",Sntana,RAIZEN,3.839,NA,"NA","NA",2020-04-27,PORTO ALEGRE,Gasolina,R$/l,2020-04-26,2020-05-02,RIO GRANDE DO SUL,4314902,"AVENIDA IPIRANGA, 1770, Sntana, PORTO ALEGRE, RIO GRANDE DO SUL, BRAZIL",-51.210535,-30.0456723,151047.42935469266,113601.26893393586,19905.79135183552,278517.72759397887,1560918.4793584573,1068314.1138538816,19953.219885073093,3207937.196295428
973,ABASTECEDORA DE COMBUSTIVEIS RESTINGA LTDA,"AVENIDA EDGAR PIRES DE CASTRO, 4100",Restinga,ALESAT,3.85,NA,"NA","NA",2020-04-27,PORTO ALEGRE,Gasolina,R$/l,2020-04-26,2020-05-02,RIO GRANDE DO SUL,4314902,"AVENIDA EDGAR PIRES DE CASTRO, 4100, Restinga, PORTO ALEGRE, RIO GRANDE DO SUL, BRAZIL",-51.1550478,-30.1653236,161992.12237824567,111466.14144259748,33058.111729545766,289725.3370771659,1568295.2325410207,1069891.5572824422,32602.976710609724,3217314.574209594
974,POSTO CAMINHOS RURAIS LTDA,"RUA DOUTOR SARMENTO BARATA, 22",Belem Velho,RAIZEN,3.85,NA,"NA","NA",2020-04-27,PORTO ALEGRE,Gasolina,R$/l,2020-04-26,2020-05-02,RIO GRANDE DO SUL,4314902,"RUA DOUTOR SARMENTO BARATA, 22, Belem Velho, PORTO ALEGRE, RIO GRANDE DO SUL, BRAZIL",-51.1769764,-30.11357629999999,157208.63471371395,112415.70056143208,27249.213319569142,284791.6287693268,1564993.445707318,1069224.2795031823,26916.37716106288,3213163.2308696476
975,CARREFOUR COMERCIO E INDUSTRIA LTDA,"RUA ALBION, 111 SETOR I",Partenon,BRANCA,3.859,NA,"NA","NA",2020-04-27,PORTO ALEGRE,Gasolina,R$/l,2020-04-26,2020-05-02,RIO GRANDE DO SUL,4314902,"RUA ALBION, 111 SETOR I, Partenon, PORTO ALEGRE, RIO GRANDE DO SUL, BRAZIL",-51.165,-30.0605556,152879.90792893645,113450.03536993678,21406.908992617078,282590.79606364603,1560239.6300387264,1068398.0321091749,20992.764646057236,3207403.880575211
976,POSTO DE COMBUSTIVEIS AVENIDA IPIRANGA EIRELI,"AVENIDA IPIRANGA, 4850",Azenha,IPIRANGA,3.859,NA,"NA","NA",2020-04-27,PORTO ALEGRE,Gasolina,R$/l,2020-04-26,2020-05-02,RIO GRANDE DO SUL,4314902,"AVENIDA IPIRANGA, 4850, Azenha, PORTO ALEGRE, RIO GRANDE DO SUL, BRAZIL",-51.1898712,-30.05463439999999,152018.74256647538,113531.17272021012,20748.244682486617,280211.35434631543,1560777.096752205,1068397.634066692,20539.606206654702,3207911.9933981765
977,AUTO POSTO CARIBE LTDA. - ME,"AVENIDA ANTONIO CARVALHO, 2114",Agronomia,BRANCA,3.869,NA,"NA","NA",2020-04-27,PORTO ALEGRE,Gasolina,R$/l,2020-04-26,2020-05-02,RIO GRANDE DO SUL,4314902,"AVENIDA ANTONIO CARVALHO, 2114, Agronomia, PORTO ALEGRE, RIO GRANDE DO SUL, BRAZIL",-51.14497009999999,-30.0504213,152400.46445428755,113603.05377906671,20493.72186885525,283636.98676264466,1558623.018324788,1068160.4130515412,19912.350812807686,3205524.818446771
978,COMERCIAL TRES FIGUEIRAS LTDA,"AVENIDA PROF.CRISTIANO FISCHER, 1950",Partenon,BRANCA,3.879,NA,"NA","NA",2020-04-27,PORTO ALEGRE,Gasolina,R$/l,2020-04-26,2020-05-02,RIO GRANDE DO SUL,4314902,"AVENIDA PROF.CRISTIANO FISCHER, 1950, Partenon, PORTO ALEGRE, RIO GRANDE DO SUL, BRAZIL",-51.1680608,-30.0560138,152446.30553909714,113540.25008275047,20888.99074658551,282073.32711664937,1559997.6434537736,1068343.601354871,20499.195720743144,3207089.9299371927
979,LAGOS DE IPANEMA - COMERCIO DE COMBUSTIVEIS LTDA,"ESTRADA EDGAR PIRES DE CASTRO, 1800",Hipica,IPIRANGA,3.879,NA,"NA","NA",2020-04-27,PORTO ALEGRE,Gasolina,R$/l,2020-04-26,2020-05-02,RIO GRANDE DO SUL,4314902,"ESTRADA EDGAR PIRES DE CASTRO, 1800, Hipica, PORTO ALEGRE, RIO GRANDE DO SUL, BRAZIL",-51.1733516,-30.15553329999999,160870.14373496934,111635.29707869938,31903.054196119225,287656.6022848438,1568232.3284788246,1069828.516482321,31543.00558608707,3217147.599047465
980,LCB ABASTECEDORA DE COMBUSTIVEIS LTDA,"AVENIDA EDGAR PIRES DE CASTRO, 3020",Aberta dos Morros,PETROBRAS DISTRIBUIDORA S.A.,3.889,NA,"NA","NA",2020-04-27,PORTO ALEGRE,Gasolina,R$/l,2020-04-26,2020-05-02,RIO GRANDE DO SUL,4314902,"AVENIDA EDGAR PIRES DE CASTRO, 3020, Aberta dos Morros, PORTO ALEGRE, RIO GRANDE DO SUL, BRAZIL",-51.16164389999999,-30.1577185,161231.28946323393,111604.97241359907,32179.973843652697,288727.66958181246,1567941.8830152145,1069810.1110917777,31757.70132893689,3216851.4600322233
981,POSTO DE COMBUSTIVEIS ALICAR LTDA,"AVENIDA BENTO GONCALVES, 4985",Partenon,IPIRANGA,3.897,NA,"NA","NA",2020-04-27,PORTO ALEGRE,Gasolina,R$/l,2020-04-26,2020-05-02,RIO GRANDE DO SUL,4314902,"AVENIDA BENTO GONCALVES, 4985, Partenon, PORTO ALEGRE, RIO GRANDE DO SUL, BRAZIL",-51.1658714,-30.0622764,153010.77890031625,113416.63577699999,21592.727391915436,282621.07353101793,1560413.2781339136,1068426.7583833034,21185.72477757203,3207611.9784070347
982,POSTO DE COMBUSTIVEIS ALICAR LTDA,"AVENIDA BENTO GONCALVES, 4937",Partenon,IPIRANGA,3.897,NA,"NA","NA",2020-04-27,PORTO ALEGRE,Gasolina,R$/l,2020-04-26,2020-05-02,RIO GRANDE DO SUL,4314902,"AVENIDA BENTO GONCALVES, 4937, Partenon, PORTO ALEGRE, RIO GRANDE DO SUL, BRAZIL",-51.1662565,-30.0621902,152997.16945588653,113418.43920474953,21581.244386209262,282584.5486256446,1560421.8694202183,1068427.0365006577,21177.280276710102,3207620.369540789
983,3A COMERCIAL DE COMBUSTIVEIS LTDA,"AVENIDA JUCA BATISTA, 3722",Hipica,PETROBRAS DISTRIBUIDORA S.A.,3.899,NA,"NA","NA",2020-04-27,PORTO ALEGRE,Gasolina,R$/l,2020-04-26,2020-05-02,RIO GRANDE DO SUL,4314902,"AVENIDA JUCA BATISTA, 3722, Hipica, PORTO ALEGRE, RIO GRANDE DO SUL, BRAZIL",-51.196922,-30.1561706,160629.7529514019,111563.46220227891,32024.406513469014,285816.1428439263,1569234.5138137548,1069927.5449719066,31790.7886143167,3218242.485468716
984,COMERCIAL DE COMBUSTIVEIS ANTONIO CARVALHO BR 3 LTDA,"AVENIDA ANTONIO DE CARVALHO, 1585",Agronomia,PETROBRAS DISTRIBUIDORA S.A.,3.899,NA,"NA","NA",2020-04-27,PORTO ALEGRE,Gasolina,R$/l,2020-04-26,2020-05-02,RIO GRANDE DO SUL,4314902,"AVENIDA ANTONIO DE CARVALHO, 1585, Agronomia, PORTO ALEGRE, RIO GRANDE DO SUL, BRAZIL",-51.1472274,-30.0555958,152787.58526912032,113512.17480478107,21029.012531135257,283753.7842476653,1559129.3342048097,1068246.9626254458,20470.77616845161,3206134.6869145464
985,COMÉRCIO DE COMBUSTÍVEIS LASSARI LTDA.,"AVENIDA IPIRANGA, 3884",Azenha,IPIRANGA,3.899,NA,"NA","NA",2020-04-27,PORTO ALEGRE,Gasolina,R$/l,2020-04-26,2020-05-02,RIO GRANDE DO SUL,4314902,"AVENIDA IPIRANGA, 3884, Azenha, PORTO ALEGRE, RIO GRANDE DO SUL, BRAZIL",-51.1933879,-30.052067,151759.48527152216,113569.07798733487,20486.327237384525,279772.6635633211,1560716.1680902874,1068369.5398514462,20309.806867210194,3207813.3330891174
986,IPI 1 - ABASTECEDORA DE COMBUSTIVEIS LTDA.,"AVENIDA IPIRANGA, 6900",Jardim Botanico,RAIZEN,3.899,NA,"NA","NA",2020-04-27,PORTO ALEGRE,Gasolina,R$/l,2020-04-26,2020-05-02,RIO GRANDE DO SUL,4314902,"AVENIDA IPIRANGA, 6900, Jardim Botanico, PORTO ALEGRE, RIO GRANDE DO SUL, BRAZIL",-51.1695435,-30.05525829999999,152358.69759961683,113555.12030603105,20799.39006919953,281907.6966574714,1559996.845364175,1068338.236904194,20421.78739527262,3207080.4580829022
987,COMERCIAL DE COMBUSTIVEIS LANCE EIRELI,"AVENIDA IPIRANGA, 8129",Jardim Carvalho,PETROBRAS DISTRIBUIDORA S.A.,3.899,NA,"NA","NA",2020-04-27,PORTO ALEGRE,Gasolina,R$/l,2020-04-26,2020-05-02,RIO GRANDE DO SUL,4314902,"AVENIDA IPIRANGA, 8129, Jardim Carvalho, PORTO ALEGRE, RIO GRANDE DO SUL, BRAZIL",-51.1557829,-30.0576091,152792.93418061323,113496.21301839876,21151.378358927366,283171.1130383946,1559632.3642334796,1068315.8735395856,20662.656462155126,3206708.6324347877
988,COMERCIAL DE COMBUSTIVEIS INTERCAP LTDA,"AVENIDA BENTO GONCALVES, 5300",Agronomia,RAIZEN,3.899,NA,"NA","NA",2020-04-27,PORTO ALEGRE,Gasolina,R$/l,2020-04-26,2020-05-02,RIO GRANDE DO SUL,4314902,"AVENIDA BENTO GONCALVES, 5300, Agronomia, PORTO ALEGRE, RIO GRANDE DO SUL, BRAZIL",-51.1624541,-30.0620751,153051.06932673242,113418.57592187778,21590.473591278133,282888.26952839637,1560259.4838714222,1068409.854021492,21156.44791890602,3207442.1608914784
989,GARAGEM RECORD LTDA,"AVENIDA IPIRANGA, 1231",Menino Deus,RAIZEN,3.899,NA,"NA","NA",2020-04-27,PORTO ALEGRE,Gasolina,R$/l,2020-04-26,2020-05-02,RIO GRANDE DO SUL,4314902,"AVENIDA IPIRANGA, 1231, Menino Deus, PORTO ALEGRE, RIO GRANDE DO SUL, BRAZIL",-51.2157038,-30.0483031,151228.15133484447,113511.44501781273,20257.267711507902,279089.30459007807,1561346.570001675,1068363.4212848847,20363.084144869987,3208424.2932154173
990,LIBERDADE POSTO DE SERVICOS EIRELI,"AVENIDA CORONEL APARICIO BORGES, 1768",Partenon,PETROBRAS DISTRIBUIDORA S.A.,3.999,NA,"NA","NA",2020-04-27,PORTO ALEGRE,Gasolina,R$/l,2020-04-26,2020-05-02,RIO GRANDE DO SUL,4314902,"AVENIDA CORONEL APARICIO BORGES, 1768, Partenon, PORTO ALEGRE, RIO GRANDE DO SUL, BRAZIL",-51.1905291,-30.07113679999999,153409.89533139707,113202.8503914374,22578.29136239663,281138.68255011993,1562129.7919995592,1068644.1544037897,22360.161154633883,3209569.169512849
991,COMERCIAL DE COMBUSTIVEIS SHANGHAI LTDA,"AVENIDA TEREZOPOLIS, 3368",Terezopolis,RAIZEN,3.999,NA,"NA","NA",2020-04-27,PORTO ALEGRE,Gasolina,R$/l,2020-04-26,2020-05-02,RIO GRANDE DO SUL,4314902,"AVENIDA TEREZOPOLIS, 3368, Terezopolis, PORTO ALEGRE, RIO GRANDE DO SUL, BRAZIL",-51.2120044,-30.0819582,154108.06112018917,112885.83542443013,23920.458756383447,281152.91418176104,1563887.23816671,1068863.3607142025,23901.367208367625,3211580.8677490475
992,POSTO DE SERVICOS 2Z LTDA.,"RUA PROFESSOR CRISTIANO FISCHER, 1272",Petropolis,IPIRANGA,3.999,NA,"NA","NA",2020-04-27,PORTO ALEGRE,Gasolina,R$/l,2020-04-26,2020-05-02,RIO GRANDE DO SUL,4314902,"RUA PROFESSOR CRISTIANO FISCHER, 1272, Petropolis, PORTO ALEGRE, RIO GRANDE DO SUL, BRAZIL",-51.1714843,-30.0512128,151986.68381218996,113634.67653576302,20344.84357271553,281511.20959458215,1559750.0809983974,1068286.1875345623,19983.787078264475,3206766.4159236564
