StationID,RzSocial,Endereco,Bairro,Bandeira,PcVenda,PcCompra,ModCompra,Fornecedor,DtColeta,Cidade,Produto,UnidMedida,DtInicial,DtFinal,Estado,CodIBGE,Place,Lon,Lat,DistMean,DistDev,DistMin,DistMax,RefinMean,RefinDev,RefinMin,RefinMax
1,AUTO POSTO MENCOROSSI LTDA,"AVENIDA AIRTON PRETINI, 43",Penha,BRANCA,3.279,NA,"NA","NA",2020-04-29,SAO PAULO,Gasolina,R$/l,2020-04-26,2020-05-02,SAO PAULO,3550308,"AVENIDA AIRTON PRETINI, 43, Penha, SAO PAULO, SAO PAULO, BRAZIL",-46.55426869999999,-23.5294273,47046.77842493985,37818.05986306779,8729.371708164332,107250.41137790514,1004598.6422308779,904749.3105273118,14270.683939356673,2677618.949598911
2,POSTO DE SERVICOS VILA RICA LTDA,"AVENIDA DEP. CANTIDIO SAMPAIO, 1000",Vila Rica,BRANCA,3.349,NA,"NA","NA",2020-04-29,SAO PAULO,Gasolina,R$/l,2020-04-26,2020-05-02,SAO PAULO,3550308,"AVENIDA DEP. CANTIDIO SAMPAIO, 1000, Vila Rica, SAO PAULO, SAO PAULO, BRAZIL",-46.6770672,-23.4686788,49858.77358369111,33669.12645311886,14818.212980715465,95103.57266152228,1006579.724369019,901299.9124313258,27465.68991204513,2664968.693308608
3,AUTO POSTO MMS LTDA,"AVENIDA GENERAL PENHA BRASIL, 309 LETRA A",Vila Angelica,BRANCA,3.399,NA,"NA","NA",2020-04-29,SAO PAULO,Gasolina,R$/l,2020-04-26,2020-05-02,SAO PAULO,3550308,"AVENIDA GENERAL PENHA BRASIL, 309 LETRA A, Vila Angelica, SAO PAULO, SAO PAULO, BRAZIL",-46.6665068,-23.4702189,49422.28214292613,33659.15480296632,15804.657114993804,95798.14787538584,1006305.018566784,901450.044544613,26575.850012018647,2665719.3946342915
4,AUTO POSTO PANTERA LTDA,"AVENIDA CASSANDOCA, 930",Moóca,BRANCA,3.399,NA,"NA","NA",2020-04-27,SAO PAULO,Gasolina,R$/l,2020-04-26,2020-05-02,SAO PAULO,3550308,"AVENIDA CASSANDOCA, 930, Moóca, SAO PAULO, SAO PAULO, BRAZIL",-46.589438,-23.5554494,47441.14131427205,38772.17359608593,5344.040415591474,107684.6306265163,1006186.7421078364,905631.3833556382,14375.077883980874,2677956.2429312933
5,POSTO CASTILHO LIMITADA,"RUA DO ORATORIO, 3286",Vila Prudente,BRANCA,3.399,NA,"NA","NA",2020-04-27,SAO PAULO,Gasolina,R$/l,2020-04-26,2020-05-02,SAO PAULO,3550308,"RUA DO ORATORIO, 3286, Vila Prudente, SAO PAULO, SAO PAULO, BRAZIL",-46.57938559999999,-23.5744975,47461.81183007152,39878.08309119749,3233.474577611691,110017.93928350939,1006397.1845928265,906492.8563845654,12256.195642812632,2680276.153704557
6,AUTO POSTO LARGO DE PINHEIROS LTDA,"RUA DOS PINHEIROS, 1501",Jardim das Rosas - Pinheiros,PETROBRAS DISTRIBUIDORA S.A.,3.399,NA,"NA","NA",2020-04-29,SAO PAULO,Gasolina,R$/l,2020-04-26,2020-05-02,SAO PAULO,3550308,"RUA DOS PINHEIROS, 1501, Jardim das Rosas - Pinheiros, SAO PAULO, SAO PAULO, BRAZIL",-46.6922291,-23.5681207,50823.93403886388,37883.17477732294,11743.267137325569,104007.45193684095,1009624.1052443152,905201.3367889937,22824.87316425511,2673188.7551257913
7,AUTO POSTO ANA CAROLINA LTDA.,"AVENIDA SAO MIGUEL, 6337",São Miguel Paulista,RAIZEN,3.399,NA,"NA","NA",2020-04-29,SAO PAULO,Gasolina,R$/l,2020-04-26,2020-05-02,SAO PAULO,3550308,"AVENIDA SAO MIGUEL, 6337, São Miguel Paulista, SAO PAULO, SAO PAULO, BRAZIL",-46.473225,-23.5040796,47342.93012797997,37542.79454353885,5274.934772302254,110019.35016671612,1002171.3838577236,903821.3549533462,15095.498755841276,2680023.0203743135
8,AUTO POSTO LIK LTDA,"RUA FERNANDO FALCAO, 537",Mooca,IPIRANGA,3.399,NA,"NA","NA",2020-04-27,SAO PAULO,Gasolina,R$/l,2020-04-26,2020-05-02,SAO PAULO,3550308,"RUA FERNANDO FALCAO, 537, Mooca, SAO PAULO, SAO PAULO, BRAZIL",-46.5859617,-23.5584477,47411.40524726373,38971.67284993156,4985.412890174758,108154.31532494907,1006165.6346647309,905781.8723866151,13889.464801439934,2678430.9303826056
9,AUTO POSTO DE SERVICOS GIRASSOL LTDA,"RUA INACIO PEREIRA DA ROCHA, 50",Pinheiros,TOTAL BRASIL,3.399,NA,"NA","NA",2020-04-28,SAO PAULO,Gasolina,R$/l,2020-04-26,2020-05-02,SAO PAULO,3550308,"RUA INACIO PEREIRA DA ROCHA, 50, Pinheiros, SAO PAULO, SAO PAULO, BRAZIL",-46.6877125,-23.558753,50479.82753500135,37625.92884787608,11709.045845924733,103294.20885375576,1009218.8906134638,904884.0565427376,22784.178097780008,2672591.0885454942
10,AUTO POSTO LINDOIA LTDA,"RUA MARIA DAFFRE, 415",Vl Prudente,BRANCA,3.449,3.036,CIF,FERA,2020-04-27,SAO PAULO,Gasolina,R$/l,2020-04-26,2020-05-02,SAO PAULO,3550308,"RUA MARIA DAFFRE, 415, Vl Prudente, SAO PAULO, SAO PAULO, BRAZIL",-46.58795730000001,-23.5851508,47690.268504800224,40319.05313475241,2068.0521392500336,110567.1386461287,1006928.4881453123,906853.6423939706,12348.536317384182,2680753.505211294
11,AUTO POSTO RIMINI LTDA,"AVENIDA MARECHAL TITO, 5350",Itaim Paulista,BRANCA,3.469,NA,"NA","NA",2020-04-29,SAO PAULO,Gasolina,R$/l,2020-04-26,2020-05-02,SAO PAULO,3550308,"AVENIDA MARECHAL TITO, 5350, Itaim Paulista, SAO PAULO, SAO PAULO, BRAZIL",-46.3932349,-23.4968524,49552.03761419562,37474.76485118677,5717.2676375309065,114790.80553749792,1000611.6741772433,903288.3978316443,18304.857554362126,2684039.8855287847
12,AUTO POSTO EWAMARO LTDA,"AVENIDA CONDESSA ELIZABETH DE ROBIANO, S/N ESQ.C/R.ANT.MACEDO, 65",Vila Guilherme,IPIRANGA,3.469,NA,"NA","NA",2020-04-29,SAO PAULO,Gasolina,R$/l,2020-04-26,2020-05-02,SAO PAULO,3550308,"AVENIDA CONDESSA ELIZABETH DE ROBIANO, S/N ESQ.C/R.ANT.MACEDO, 65, Vila Guilherme, SAO PAULO, SAO PAULO, BRAZIL",-46.5748378,-23.5268157,47178.55742232641,37474.10957787909,8532.154190187952,105824.5617429902,1005076.721433317,904520.4720366488,15682.005322781784,2676188.626893706
13,AUTO POSTO EUROPA GARDEN LTDA,"AVENIDA MARECHAL TITO, 7059",Cidade Nitro Operario,RAIZEN,3.479,NA,"NA","NA",2020-04-29,SAO PAULO,Gasolina,R$/l,2020-04-26,2020-05-02,SAO PAULO,3550308,"AVENIDA MARECHAL TITO, 7059, Cidade Nitro Operario, SAO PAULO, SAO PAULO, BRAZIL",-46.3822333,-23.4865303,49940.08991377694,37109.91455575755,6211.504006605256,114727.71412872877,1000205.8411311677,902786.5036380982,19860.19444666396,2683747.9091971833
14,COMPANHIA BRASILEIRA DE DISTRIBUICAO,"AVENIDA SAO MIGUEL, 6818 6838 PARTE",Vila Norma,IPIRANGA,3.479,NA,"NA","NA",2020-04-29,SAO PAULO,Gasolina,R$/l,2020-04-26,2020-05-02,SAO PAULO,3550308,"AVENIDA SAO MIGUEL, 6818 6838 PARTE, Vila Norma, SAO PAULO, SAO PAULO, BRAZIL",-46.4697808,-23.5017809,47368.19784120104,37506.96256449877,4853.685475433531,110046.73332392253,1002051.9046448177,903717.0328867788,15375.669600547846,2680014.793599558
15,TRI AUTO POSTO LTDA,"RUA VEREADOR CID GALVAO DA SILVA, 310",Penha de Franca,BRANCA,3.489,NA,"NA","NA",2020-04-29,SAO PAULO,Gasolina,R$/l,2020-04-26,2020-05-02,SAO PAULO,3550308,"RUA VEREADOR CID GALVAO DA SILVA, 310, Penha de Franca, SAO PAULO, SAO PAULO, BRAZIL",-46.5550674,-23.5270769,47044.879308100404,37695.07374651731,8947.172938574471,106990.41139066138,1004563.8116364861,904643.0267666504,14536.191815405864,2677358.366142311
16,AUTO POSTO 1090 LTDA,"AVENIDA PROF CELESTINO BOURROUL, 1078",Limao,BRANCA,3.489,NA,"NA","NA",2020-04-29,SAO PAULO,Gasolina,R$/l,2020-04-26,2020-05-02,SAO PAULO,3550308,"AVENIDA PROF CELESTINO BOURROUL, 1078, Limao, SAO PAULO, SAO PAULO, BRAZIL",-46.6724521,-23.5041504,49468.84776952765,35395.38539536206,14244.05856631038,98727.9084169696,1007308.7563656226,902827.5502294172,24536.636086182894,2668476.4200090617
17,AUTO POSTO ESTADO DE SAO PAULO LTDA.,"AVENIDA ENGENHEIRO CAETANO ALVES, S/N",Limao,BRANCA,3.489,3.006,FOB,FERA,2020-04-29,SAO PAULO,Gasolina,R$/l,2020-04-26,2020-05-02,SAO PAULO,3550308,"AVENIDA ENGENHEIRO CAETANO ALVES, S/N, Limao, SAO PAULO, SAO PAULO, BRAZIL",-46.6704965,-23.5091512,49450.68250983709,35704.832081121414,13690.960563635039,99307.85366302832,1007375.727590144,903051.5826364097,24040.91313516465,2669046.2904114053
18,FUKUYA KANEMOTO & CIA LTDA,"AVENIDA OTAVIANO ALVES DE LIMA, 2888",Freguesia do Ó,RAIZEN,3.499,NA,"NA","NA",2020-04-29,SAO PAULO,Gasolina,R$/l,2020-04-26,2020-05-02,SAO PAULO,3550308,"AVENIDA OTAVIANO ALVES DE LIMA, 2888, Freguesia do Ó, SAO PAULO, SAO PAULO, BRAZIL",-46.6851333,-23.5087667,49741.021733828056,35345.53302013548,13321.029424614082,98537.88199223261,1007809.6936310781,902905.4233948493,25273.18489256558,2668167.2543693464
19,POSTO DE SERVICO ITAIPAVA LTDA,"AVENIDA PROF FRANCISCO MORATO, 1070",Caxingui,BRANCA,3.499,NA,"NA","NA",2020-04-28,SAO PAULO,Gasolina,R$/l,2020-04-26,2020-05-02,SAO PAULO,3550308,"AVENIDA PROF FRANCISCO MORATO, 1070, Caxingui, SAO PAULO, SAO PAULO, BRAZIL",-46.71092609999999,-23.5796499,52026.566747527344,38232.89857799254,13181.039448507709,104320.5951327295,1010552.4889973928,905444.4805474132,24237.670207473322,2673170.563282603
20,AUTO POSTO AVEIRO DA VILA ALBERTINA EIRELI,"AVENIDA SANTA MARINA, 2268",Vila Albertina,BRANCA,3.499,NA,"NA","NA",2020-04-29,SAO PAULO,Gasolina,R$/l,2020-04-26,2020-05-02,SAO PAULO,3550308,"AVENIDA SANTA MARINA, 2268, Vila Albertina, SAO PAULO, SAO PAULO, BRAZIL",-46.6934502,-23.5050124,50126.60992366372,35272.866852875755,12477.684797538257,97772.97365228094,1007968.6823391556,902675.5821707182,26207.46868316561,2667344.702135
21,AUTO POSTO NOVO MORRO GRANDE LTDA,"AVENIDA MIGUEL CONEJO, 1051",Freguesia do O,PETROBRAS DISTRIBUIDORA S.A.,3.499,NA,"NA","NA",2020-04-29,SAO PAULO,Gasolina,R$/l,2020-04-26,2020-05-02,SAO PAULO,3550308,"AVENIDA MIGUEL CONEJO, 1051, Freguesia do O, SAO PAULO, SAO PAULO, BRAZIL",-46.69230460000001,-23.4944582,50038.125998870695,34709.76197309423,12684.827904568225,96805.30438075507,1007667.2908142548,902250.9494150147,26799.093776034068,2666445.6557136886
22,CARLOS ALBERTO PAPACIDERO,"AVENIDA PROFESSOR CELESTINO BOURROUL, 34",Limao,RAIZEN,3.499,NA,"NA","NA",2020-04-29,SAO PAULO,Gasolina,R$/l,2020-04-26,2020-05-02,SAO PAULO,3550308,"AVENIDA PROFESSOR CELESTINO BOURROUL, 34, Limao, SAO PAULO, SAO PAULO, BRAZIL",-46.6724025,-23.513202,49508.28112696939,35869.91644434442,13481.797526357073,99601.67248996465,1007535.8811414939,903201.8282216225,23929.92791051343,2669306.6389837847
23,AUTO POSTO DHERINHO LTDA,"RUA JOAO RUDGE, 101",Casa Verde,BRANCA,3.499,3.075,FOB,FERA,2020-04-29,SAO PAULO,Gasolina,R$/l,2020-04-26,2020-05-02,SAO PAULO,3550308,"RUA JOAO RUDGE, 101, Casa Verde, SAO PAULO, SAO PAULO, BRAZIL",-46.6553333,-23.5155194,48756.4813030665,35816.95435904314,12173.06521093238,100427.9521002239,1007082.7053128914,903445.8849794411,22383.6609834598,2670503.0836007213
24,CENTRO DE ABASTECIMENTO DE GAS MILENA LTDA,"AVENIDA OTAVIANO ALVES DE LIMA, 3926",Nossa Sra do O,RAIZEN,3.499,NA,"NA","NA",2020-04-29,SAO PAULO,Gasolina,R$/l,2020-04-26,2020-05-02,SAO PAULO,3550308,"AVENIDA OTAVIANO ALVES DE LIMA, 3926, Nossa Sra do O, SAO PAULO, SAO PAULO, BRAZIL",-46.6956635,-23.5068296,50169.87151003217,35300.33733624468,12246.974046340585,97841.76953004513,1008083.080569911,902729.6848944261,26279.60638860512,2667383.37914954
25,AUTO POSTO GREEN LTDA,"AVENIDA JOAO PAULO I, 370",Nossa Senhora do O,BRANCA,3.499,3.016,FOB,FERA,2020-04-29,SAO PAULO,Gasolina,R$/l,2020-04-26,2020-05-02,SAO PAULO,3550308,"AVENIDA JOAO PAULO I, 370, Nossa Senhora do O, SAO PAULO, SAO PAULO, BRAZIL",-46.6883383,-23.4902672,49976.04034795617,34596.77486592172,13150.39564993123,96597.70540906453,1007442.3026510192,902112.1566057176,26762.425866223704,2666291.17673353
26,CARREFOUR COMERCIO E INDUSTRIA LTDA,"AVENIDA PROFESSOR CELESTINO BOURROUL, 151",Bairro Limao,PETROBRAS DISTRIBUIDORA S.A.,3.499,NA,"NA","NA",2020-04-29,SAO PAULO,Gasolina,R$/l,2020-04-26,2020-05-02,SAO PAULO,3550308,"AVENIDA PROFESSOR CELESTINO BOURROUL, 151, Bairro Limao, SAO PAULO, SAO PAULO, BRAZIL",-46.6733912,-23.5123829,49523.0741539124,35803.86319288123,13616.825779436196,99473.00053443444,1007544.9425603984,903159.3525163275,24064.947034391396,2669174.753925172
27,CENTRO AUTOMOTIVO MARECHAL TITO LTDA,"AVENIDA MARECHAL TITO, 3300",Sao Miguel,RAIZEN,3.499,NA,"NA","NA",2020-04-29,SAO PAULO,Gasolina,R$/l,2020-04-26,2020-05-02,SAO PAULO,3550308,"AVENIDA MARECHAL TITO, 3300, Sao Miguel, SAO PAULO, SAO PAULO, BRAZIL",-46.414722,-23.4947016,48655.597605897194,37552.78026256908,3904.4716585763704,113133.34574015232,1000900.8289158363,903284.4893573902,17533.913761957603,2682587.1335318256
28,COMPANHIA BRASILEIRA DE DISTRIBUICAO,"AVENIDA NOSSA SENHORA DO O, 1759 2003, PARTE",Freguesia do O,IPIRANGA,3.499,NA,"NA","NA",2020-04-29,SAO PAULO,Gasolina,R$/l,2020-04-26,2020-05-02,SAO PAULO,3550308,"AVENIDA NOSSA SENHORA DO O, 1759 2003, PARTE, Freguesia do O, SAO PAULO, SAO PAULO, BRAZIL",-46.6898113,-23.5053172,50086.797385358856,35412.452334767426,12848.191520929251,97981.16543842723,1007864.9046369342,902721.303866156,25883.839314272587,2667582.2514632833
29,AUTO POSTO DINOSSAUROS LTDA.,"AVENIDA SAO MIGUEL, 1688",Vila Buenos Aires,BRANCA,3.499,NA,"NA","NA",2020-04-29,SAO PAULO,Gasolina,R$/l,2020-04-26,2020-05-02,SAO PAULO,3550308,"AVENIDA SAO MIGUEL, 1688, Vila Buenos Aires, SAO PAULO, SAO PAULO, BRAZIL",-46.5144007,-23.5125756,47035.14669170174,37417.63083778646,9092.45771588096,108146.46805042353,1003242.600679302,904158.2208788159,14490.317914176207,2678398.770956481
30,AUTO POSTO SINHA MOCA LIMITADA,"RUA CAP PACHECO E CHAVES, 394",Vila Prudente,BRANCA,3.499,3.049,FOB,STOCK,2020-04-27,SAO PAULO,Gasolina,R$/l,2020-04-26,2020-05-02,SAO PAULO,3550308,"RUA CAP PACHECO E CHAVES, 394, Vila Prudente, SAO PAULO, SAO PAULO, BRAZIL",-46.5928425,-23.5819467,47737.76599971608,40076.119245755304,2552.630610715973,110005.85515007438,1006982.991361577,906684.2975735655,12957.500311410438,2680178.765776533
31,AUTO POSTO BLUE LTDA,"AVENIDA OTAVIANO ALVES DE LIMA, 3600",Casa Verde,BRANCA,3.499,NA,"NA","NA",2020-04-29,SAO PAULO,Gasolina,R$/l,2020-04-26,2020-05-02,SAO PAULO,3550308,"AVENIDA OTAVIANO ALVES DE LIMA, 3600, Casa Verde, SAO PAULO, SAO PAULO, BRAZIL",-46.6923801,-23.5071506,50133.22149891741,35428.3119126582,12581.802152913662,98033.19958725934,1007990.3332219665,902773.062511926,25982.781922205282,2667601.8901145034
32,AUTO POSTO BOTURUÇU LTDA,"AVENIDA ITABERABA, 3074",Freguesia do Ó,RAIZEN,3.499,NA,"NA","NA",2020-04-29,SAO PAULO,Gasolina,R$/l,2020-04-26,2020-05-02,SAO PAULO,3550308,"AVENIDA ITABERABA, 3074, Freguesia do Ó, SAO PAULO, SAO PAULO, BRAZIL",-46.697539,-23.500336,50136.848929204716,34874.12948820623,12088.131513645705,97118.35601831044,1007975.5302005785,902446.0725730646,26846.80821774678,2666681.4735797006
33,AUTO POSTO ATLANTA LTDA,"AVENIDA SAPOPEMBA, 579",Água Rasa,BRANCA,3.549,3.019,FOB,RAIZEN,2020-04-27,SAO PAULO,Gasolina,R$/l,2020-04-26,2020-05-02,SAO PAULO,3550308,"AVENIDA SAPOPEMBA, 579, Água Rasa, SAO PAULO, SAO PAULO, BRAZIL",-46.5742126,-23.5617655,47307.98593720174,39270.8584419338,4714.3104312493415,109105.17496042182,1005922.4731600542,906005.8342142281,12749.849634084625,2679413.2846418256
34,NOVASOC COMERCIAL LTDA,"AVENIDA CONDESSA ELISABETH DE ROBIANO, 5500 PARTE II",Jardim America da Penha,IPIRANGA,3.549,3.283,CIF,"NA",2020-04-29,SAO PAULO,Gasolina,R$/l,2020-04-26,2020-05-02,SAO PAULO,3550308,"AVENIDA CONDESSA ELISABETH DE ROBIANO, 5500 PARTE II, Jardim America da Penha, SAO PAULO, SAO PAULO, BRAZIL",-46.5545799,-23.512737,47040.36169451125,36993.136023543986,10474.908470448214,105722.86200342716,1004217.2571713427,904019.2179880993,15901.45310097991,2676079.5562813506
35,AUTO POSTO TREVO DA SORTE LTDA,"RUA IBITIRAMA, 704",Vila Prudente,IPIRANGA,3.577,3.148,CIF,"NA",2020-04-27,SAO PAULO,Gasolina,R$/l,2020-04-26,2020-05-02,SAO PAULO,3550308,"RUA IBITIRAMA, 704, Vila Prudente, SAO PAULO, SAO PAULO, BRAZIL",-46.584633,-23.5878916,47673.51948852752,40507.55006834338,1721.6894540966912,111002.48127999227,1006907.1360922703,906991.0046651089,11904.039298832467,2681195.7928587743
36,MARECHAL FUEL POSTO DE SERVIÇOS LTDA.,"RUA DOUTOR JOSÉ PEREIRA GOMES, 35",Jardim das Oliveiras,IPIRANGA,3.579,NA,"NA","NA",2020-04-29,SAO PAULO,Gasolina,R$/l,2020-04-26,2020-05-02,SAO PAULO,3550308,"RUA DOUTOR JOSÉ PEREIRA GOMES, 35, Jardim das Oliveiras, SAO PAULO, SAO PAULO, BRAZIL",-46.3861296,-23.4908768,49801.28716020312,37261.514246294835,6024.080749278614,114803.12853920982,1000365.2324462567,902994.4869703173,19242.699385543267,2683913.87028869
37,AUTO POSTO COMARIS LTDA,"AVENIDA DO CURSINO, 6467",Jardim Celeste,BRANCA,3.579,NA,"NA","NA",2020-04-28,SAO PAULO,Gasolina,R$/l,2020-04-26,2020-05-02,SAO PAULO,3550308,"AVENIDA DO CURSINO, 6467, Jardim Celeste, SAO PAULO, SAO PAULO, BRAZIL",-46.6141839,-23.6558533,51296.335235430895,41477.61983017427,5891.560176455172,116060.25474137929,1009858.2745578372,909218.186327459,13530.565118082086,2685703.84802951
38,AUTO POSTO MKM LTDA.,"AVENIDA SÃO MIGUEL, 4681",Parque Boturussu,BRANCA,3.579,NA,"NA","NA",2020-04-29,SAO PAULO,Gasolina,R$/l,2020-04-26,2020-05-02,SAO PAULO,3550308,"AVENIDA SÃO MIGUEL, 4681, Parque Boturussu, SAO PAULO, SAO PAULO, BRAZIL",-46.4881973,-23.5071487,47196.2054167273,37483.16334063373,6596.084781333724,109320.49720915967,1002546.4962404083,903956.1496889658,14735.544054665432,2679429.7749694665
39,POSTO DE SERVIÇO RIO BRANCO EIRELI - EPP.,"AVENIDA SAO MIGUEL, 3608",Vila Rio Branco,BRANCA,3.579,NA,"NA","NA",2020-04-29,SAO PAULO,Gasolina,R$/l,2020-04-26,2020-05-02,SAO PAULO,3550308,"AVENIDA SAO MIGUEL, 3608, Vila Rio Branco, SAO PAULO, SAO PAULO, BRAZIL",-46.4978296,-23.510302,47129.81452238767,37498.12475471292,7576.328878986529,108983.18969892964,1002822.4219161317,904087.7162661552,14458.54151214768,2679155.875153879
40,POSTO DE SERVICO APOLO 8 LTDA,"AVENIDA MORVAN DIAS DE FIGUEIREDO, 2391",Vila Guilherme,IPIRANGA,3.579,NA,"NA","NA",2020-04-29,SAO PAULO,Gasolina,R$/l,2020-04-26,2020-05-02,SAO PAULO,3550308,"AVENIDA MORVAN DIAS DE FIGUEIREDO, 2391, Vila Guilherme, SAO PAULO, SAO PAULO, BRAZIL",-46.609064,-23.5221629,47675.51341076676,36790.471691721104,9362.78692320668,103496.42873741215,1005905.8488933628,904091.5781977534,18359.456488179374,2673782.939246776
41,AUTO POSTO GIZA LTDA,"AVENIDA SAO MIGUEL, 5891",Ermelino Matarazzo,BRANCA,3.579,3.006,FOB,PETROZARA,2020-04-29,SAO PAULO,Gasolina,R$/l,2020-04-26,2020-05-02,SAO PAULO,3550308,"AVENIDA SAO MIGUEL, 5891, Ermelino Matarazzo, SAO PAULO, SAO PAULO, BRAZIL",-46.4768196,-23.5060925,47314.68074322018,37570.57836755266,5684.788930863277,109959.44654762182,1002288.3783840248,903912.164722297,14853.74768414253,2679996.568010723
42,AUTO POSTO NOVO CANTANHEDE LTDA,"AVENIDA SAO MIGUEL, 3981",Vila Rio Branco,BRANCA,3.579,NA,"NA","NA",2020-04-29,SAO PAULO,Gasolina,R$/l,2020-04-26,2020-05-02,SAO PAULO,3550308,"AVENIDA SAO MIGUEL, 3981, Vila Rio Branco, SAO PAULO, SAO PAULO, BRAZIL",-46.49490429999999,-23.5085289,47143.758660488595,37461.03989038717,7220.193560095126,109013.80697896329,1002719.7494452728,904011.9602068055,14625.287203064345,2679164.807382271
43,CARREFOUR COMERCIO E INDUSTRIA LTDA,"VIA ANCHIETA, 3398 PARTE",Ipiranga,BRANCA,3.579,NA,"NA","NA",2020-04-28,SAO PAULO,Gasolina,R$/l,2020-04-26,2020-05-02,SAO PAULO,3550308,"VIA ANCHIETA, 3398 PARTE, Ipiranga, SAO PAULO, SAO PAULO, BRAZIL",-46.5980642,-23.6271259,49304.96897161942,41441.64838305787,2315.44438018238,114060.77543016209,1008444.999420858,908367.4421545856,11861.635207192492,2684005.1634657476
44,CENTER CAR AUTO POSTO LTDA,"AVENIDA JAGUARE, 717",Jaguaré,RAIZEN,3.597,NA,"NA","NA",2020-04-28,SAO PAULO,Gasolina,R$/l,2020-04-26,2020-05-02,SAO PAULO,3550308,"AVENIDA JAGUARE, 717, Jaguaré, SAO PAULO, SAO PAULO, BRAZIL",-46.7435143,-23.5539454,51892.85890894796,36018.03058973786,8914.40967580664,100332.07966578174,1010869.7857249733,904117.0221716163,28281.365865701136,2668946.185937585
45,VM RODRIGUES COMBUSTIVEIS LTDA,"RUA ESTEVAO RIBEIRO GARCIA, 30",Jardim Virginia,RAIZEN,3.599,NA,"NA","NA",2020-04-29,SAO PAULO,Gasolina,R$/l,2020-04-26,2020-05-02,SAO PAULO,3550308,"RUA ESTEVAO RIBEIRO GARCIA, 30, Jardim Virginia, SAO PAULO, SAO PAULO, BRAZIL",-46.3916652,-23.4960852,49611.06070922215,37443.358314900084,5804.726912811698,114837.63495871318,1000570.0034603154,903247.5716664995,18458.698957242905,2684062.185245256
46,AUTO POSTO RIGA LTDA,"VIA ANCHIETA, 1751",Moinho Velho,PETROBRAS DISTRIBUIDORA S.A.,3.599,NA,"NA","NA",2020-04-28,SAO PAULO,Gasolina,R$/l,2020-04-26,2020-05-02,SAO PAULO,3550308,"VIA ANCHIETA, 1751, Moinho Velho, SAO PAULO, SAO PAULO, BRAZIL",-46.6014318,-23.6168846,48886.42365258499,41193.67012632919,1784.3465768713872,112904.5274437755,1008235.4357717133,907957.1729235038,12388.144749910429,2682875.0562524498
47,POSTO DO PAPAI ANCHIETA LTDA,"V ANCHIETA, 862",Moinho Velho,PETROBRAS DISTRIBUIDORA S.A.,3.599,3.18,FOB,"NA",2020-04-28,SAO PAULO,Gasolina,R$/l,2020-04-26,2020-05-02,SAO PAULO,3550308,"V ANCHIETA, 862, Moinho Velho, SAO PAULO, SAO PAULO, BRAZIL",-46.6000617,-23.6092822,48529.19084339565,41053.77096864807,1444.7510501214092,112242.82047541035,1007968.6878563515,907684.5155117167,12455.697356641607,2682259.3000374166
48,AUTO POSTO ESTORIL LTDA,"RUA ALVARENGA, 2045",Butantã,RAIZEN,3.599,NA,"NA","NA",2020-04-30,SAO PAULO,Gasolina,R$/l,2020-04-26,2020-05-02,SAO PAULO,3550308,"RUA ALVARENGA, 2045, Butantã, SAO PAULO, SAO PAULO, BRAZIL",-46.7120837,-23.5635756,51531.580649059266,37525.53141239821,12200.898677315578,102665.97767973876,1010127.2655556164,904820.5864173616,24900.94233816972,2671632.0050448696
49,CUCA LEGAL AUTO SERVICOS LTDA,"AVENIDA BOTURUSSU, 415",Ermelino Matarazzo,RAIZEN,3.599,NA,"NA","NA",2020-04-29,SAO PAULO,Gasolina,R$/l,2020-04-26,2020-05-02,SAO PAULO,3550308,"AVENIDA BOTURUSSU, 415, Ermelino Matarazzo, SAO PAULO, SAO PAULO, BRAZIL",-46.4883035,-23.5035235,47173.12408025496,37347.97507086527,6347.495265912632,109000.46091767862,1002468.3011502064,903793.7181676938,15137.160806071823,2679093.7791750743
50,AUTO POSTO LARGO DO JAPONES LTDA,"AVENIDA IMIRIM, 4676",V. Nova Cachoeirinha,BRANCA,3.599,NA,"NA","NA",2020-04-29,SAO PAULO,Gasolina,R$/l,2020-04-26,2020-05-02,SAO PAULO,3550308,"AVENIDA IMIRIM, 4676, V. Nova Cachoeirinha, SAO PAULO, SAO PAULO, BRAZIL",-46.6668621,-23.4742713,49404.70101251787,33881.89342690221,15654.802885691068,96163.49998666933,1006411.8437407814,901619.644336313,26285.75838243967,2666069.0167813823
51,PAPA 5 SERVIÇOS AUTOMOTIVOS LTDA,"AVENIDA BRAZ LEME, 164",Casa Verde - Santana,RAIZEN,3.599,NA,"NA","NA",2020-04-29,SAO PAULO,Gasolina,R$/l,2020-04-26,2020-05-02,SAO PAULO,3550308,"AVENIDA BRAZ LEME, 164, Casa Verde - Santana, SAO PAULO, SAO PAULO, BRAZIL",-46.6531995,-23.5135466,48696.798166351735,35748.852608649875,12220.835150353982,100348.22388482507,1006969.684242388,903382.1412019153,22349.026627423093,2670445.9789911
52,NOVA LAREDO AUTO POSTO LTDA,"AVENIDA MAL TITO, 1688",S Miguel Paulista,BRANCA,3.599,NA,"NA","NA",2020-04-29,SAO PAULO,Gasolina,R$/l,2020-04-26,2020-05-02,SAO PAULO,3550308,"AVENIDA MAL TITO, 1688, S Miguel Paulista, SAO PAULO, SAO PAULO, BRAZIL",-46.4297669,-23.4954417,48144.150575798565,37614.810286104206,3207.61996446425,112170.49870965816,1001170.7005594549,903365.9329151129,16907.22926848533,2681774.6560449293
53,BRIDGE SERVIÇOS AUTOMOTIVOS LTDA,"AVENIDA INAJAR DE SOUZA, 40",Freguesia do Ó,RAIZEN,3.599,NA,"NA","NA",2020-04-29,SAO PAULO,Gasolina,R$/l,2020-04-26,2020-05-02,SAO PAULO,3550308,"AVENIDA INAJAR DE SOUZA, 40, Freguesia do Ó, SAO PAULO, SAO PAULO, BRAZIL",-46.6883369,-23.5049136,50066.62619491336,35439.72022411477,13000.03054736859,98014.68979127874,1007809.575350594,902718.0897422173,25786.977256859052,2667630.315446044
54,CHAPARRAL COMERCIO DE COMBUSTIVEIS AUTOMOTIVOS LTDA,"AVENIDA CONDESSA ELIZABETH ROBIANO, 2222",Penha de Franca,RAIZEN,3.599,NA,"NA","NA",2020-04-29,SAO PAULO,Gasolina,R$/l,2020-04-26,2020-05-02,SAO PAULO,3550308,"AVENIDA CONDESSA ELIZABETH ROBIANO, 2222, Penha de Franca, SAO PAULO, SAO PAULO, BRAZIL",-46.5777517,-23.5272096,47208.17369647811,37460.463607014935,8462.08541592635,105696.74910445556,1005164.4357513144,904519.414212539,15827.737215136982,2676055.7622814765
55,AUTO POSTO DESPORTIVO LTDA,"AVENIDA MAL TITO, 2400",Sao Miguel Paulista,RAIZEN,3.599,NA,"NA","NA",2020-04-29,SAO PAULO,Gasolina,R$/l,2020-04-26,2020-05-02,SAO PAULO,3550308,"AVENIDA MAL TITO, 2400, Sao Miguel Paulista, SAO PAULO, SAO PAULO, BRAZIL",-46.4232725,-23.494329,48342.23683008275,37577.865862341554,3365.374993153421,112519.00819878074,1001034.6457872051,903297.1616442157,17245.8717083271,2682053.2510723765
56,CENTRO AUTOMOTIVO LYON LTDA,"AVENIDA PADRE ARLINDO VIEIRA, 2769",Pq Bristol,RAIZEN,3.599,NA,"NA","NA",2020-04-28,SAO PAULO,Gasolina,R$/l,2020-04-26,2020-05-02,SAO PAULO,3550308,"AVENIDA PADRE ARLINDO VIEIRA, 2769, Pq Bristol, SAO PAULO, SAO PAULO, BRAZIL",-46.6054786,-23.6436077,50384.33255962667,41497.14397718701,4275.538456576757,115288.23908143415,1009190.0041607227,908883.4628183295,12536.047489793422,2685084.833368317
57,AUTO POSTO IRMAOS VENTURA LTDA,"AVENIDA PE ARLINDO VIEIRA, 727",Vila Merces,BRANCA,3.599,3.079,FOB,RAIZEN,2020-04-28,SAO PAULO,Gasolina,R$/l,2020-04-26,2020-05-02,SAO PAULO,3550308,"AVENIDA PE ARLINDO VIEIRA, 727, Vila Merces, SAO PAULO, SAO PAULO, BRAZIL",-46.6016956,-23.6286297,49472.49972463838,41382.380662798896,2664.0323221153208,114024.16634297582,1008601.3231535336,908386.7449100654,12211.008945921627,2683933.3634197144
58,AUTO POSTO MARINI LTDA,"RUA INAJAR DE SOUZA, 550",Freguesia do Ó,RAIZEN,3.599,NA,"NA","NA",2020-04-29,SAO PAULO,Gasolina,R$/l,2020-04-26,2020-05-02,SAO PAULO,3550308,"RUA INAJAR DE SOUZA, 550, Freguesia do Ó, SAO PAULO, SAO PAULO, BRAZIL",-46.687174,-23.501028,50023.86335680501,35258.70825691847,13138.986845799183,97695.84913644432,1007675.8671851362,902568.4637355764,25943.81597489658,2667342.07503377
59,NOVA CACHOEIRINHA AUTO POSTO COMERCIO LTDA,"AVENIDA INAJAR DE SOUZA, 3535",Limao,RAIZEN,3.599,NA,"NA","NA",2020-04-29,SAO PAULO,Gasolina,R$/l,2020-04-26,2020-05-02,SAO PAULO,3550308,"AVENIDA INAJAR DE SOUZA, 3535, Limao, SAO PAULO, SAO PAULO, BRAZIL",-46.673337,-23.4785434,49494.305047769725,33980.30724522022,14901.306241569157,96230.90035953878,1006705.5807708577,901748.1814426718,26439.99552082145,2666085.342692207
