StationID,RzSocial,Endereco,Bairro,Bandeira,PcVenda,PcCompra,ModCompra,Fornecedor,DtColeta,Cidade,Produto,UnidMedida,DtInicial,DtFinal,Estado,CodIBGE,Place,Lon,Lat,DistMean,DistDev,DistMin,DistMax,RefinMean,RefinDev,RefinMin,RefinMax
292,COMERCIAL AMAZONIA DE PETROLEO EIRELI,"AVENIDA FERNANDO CORREA DA COSTA, 2055 LOTE 08, 09 E 10",Boa Esperanca,BRANCA,3.877,NA,"NA","NA",2020-04-28,CUIABA,Gasolina,R$/l,2020-04-26,2020-05-02,MATO GROSSO,5103403,"AVENIDA FERNANDO CORREA DA COSTA, 2055 LOTE 08, 09 E 10, Boa Esperanca, CUIABA, MATO GROSSO, BRAZIL",-56.0706268,-15.6165086,220249.15027015278,184130.1131760853,10823.363481755216,428333.98033966083,1694325.7645331174,401624.7039885634,1225489.9312375747,2444670.2629198325
293,COMERCIAL AMAZONIA DE PETROLEO EIRELI,"AVENIDA MIGUEL SUTIL, 6039",Quilombo,BRANCA,3.877,NA,"NA","NA",2020-04-27,CUIABA,Gasolina,R$/l,2020-04-26,2020-05-02,MATO GROSSO,5103403,"AVENIDA MIGUEL SUTIL, 6039, Quilombo, CUIABA, MATO GROSSO, BRAZIL",-56.0971872,-15.5795189,222403.99213290226,182076.5957939231,14186.40663312468,424735.1882884742,1697418.2968207838,400531.827102717,1230332.853835568,2445423.4395049256
294,FRC COMERCIO DE COMBUSTIVEIS LTDA,"AVENIDA FERNANDO CORREA DA COSTA, 5573",Parque Ohara,RAIZEN,3.877,NA,"NA","NA",2020-04-28,CUIABA,Gasolina,R$/l,2020-04-26,2020-05-02,MATO GROSSO,5103403,"AVENIDA FERNANDO CORREA DA COSTA, 5573, Parque Ohara, CUIABA, MATO GROSSO, BRAZIL",-56.0475834,-15.6335394,218705.9918471314,185105.0024147964,7735.54266812185,429830.1027917574,1692107.9497177077,402019.1695505512,1222389.93474815,2443287.1634579585
295,MAKRO ATACADISTA S.A,"AVENIDA MIGUEL SUTIL, 7582 PATIO ESTACIONAMENTO",Santa Rosa,PETROBRAS DISTRIBUIDORA S.A.,3.877,NA,"NA","NA",2020-04-27,CUIABA,Gasolina,R$/l,2020-04-26,2020-05-02,MATO GROSSO,5103403,"AVENIDA MIGUEL SUTIL, 7582 PATIO ESTACIONAMENTO, Santa Rosa, CUIABA, MATO GROSSO, BRAZIL",-56.10945,-15.577882,223146.31443389444,181911.2034399686,13619.903361231736,424768.9495256305,1698371.6065718085,400604.2854900853,1231439.3729909663,2446525.151149083
296,M.A. COMÉRCIO DE COMBUSTÍVEIS LTDA,"AVENIDA MIGUEL SUTIL, 5050",Jardim Lebron,BRANCA,3.877,NA,"NA","NA",2020-04-28,CUIABA,Gasolina,R$/l,2020-04-26,2020-05-02,MATO GROSSO,5103403,"AVENIDA MIGUEL SUTIL, 5050, Jardim Lebron, CUIABA, MATO GROSSO, BRAZIL",-56.0920675,-15.579965,222104.0242676345,182128.5150233998,14473.292198998013,424696.41568235104,1697027.7197707219,400492.8947343728,1229888.3724782376,2444952.003852378
297,COMERCIAL DE COMBUSTIVEIS SANTA EDWIGES LTDA,"AVENIDA TEN. CEL. DUARTE, 154",Centro,BRANCA,3.877,NA,"NA","NA",2020-04-28,CUIABA,Gasolina,R$/l,2020-04-26,2020-05-02,MATO GROSSO,5103403,"AVENIDA TEN. CEL. DUARTE, 154, Centro, CUIABA, MATO GROSSO, BRAZIL",-56.0965952,-15.6011638,221990.0713450499,183187.6547742241,12359.234190243053,427089.5099025311,1696708.7220782188,401330.0780829505,1228702.4414630036,2446420.6554171224
298,COMERCIAL AMAZONIA DE PETROLEO EIRELI,"RUA JOAQUIM MURTINHO, 810",Centro Sul,BRANCA,3.877,NA,"NA","NA",2020-04-27,CUIABA,Gasolina,R$/l,2020-04-26,2020-05-02,MATO GROSSO,5103403,"RUA JOAQUIM MURTINHO, 810, Centro Sul, CUIABA, MATO GROSSO, BRAZIL",-56.10069189999999,-15.6018769,222223.09258606329,183188.13677262195,12008.469475996779,427237.470316265,1696988.5323456768,401400.7674501697,1228980.3341464722,2446849.837229046
299,BOM CLIMA COMERCIO DE COMBUSTIVEIS LTDA,"AVENIDA REPUBLICA DO LIBANO, 1628",Jardim Monte Libano,RAIZEN,3.879,NA,"NA","NA",2020-04-27,CUIABA,Gasolina,R$/l,2020-04-26,2020-05-02,MATO GROSSO,5103403,"AVENIDA REPUBLICA DO LIBANO, 1628, Jardim Monte Libano, CUIABA, MATO GROSSO, BRAZIL",-56.085461,-15.5652609,222058.3256009551,181340.71385052282,15681.103707897766,422977.7416149595,1696995.333304345,399875.90823190723,1230434.4713176314,2443600.1340114586
300,AUTO POSTO GRANEL LTDA,"AVENIDA FERNANDO CORREA DA COSTA, 4413",Coxipo,RAIZEN,3.879,NA,"NA","NA",2020-04-28,CUIABA,Gasolina,R$/l,2020-04-26,2020-05-02,MATO GROSSO,5103403,"AVENIDA FERNANDO CORREA DA COSTA, 4413, Coxipo, CUIABA, MATO GROSSO, BRAZIL",-56.05705200000001,-15.627078,219327.6924469808,184732.06669255302,8972.443080137637,429271.93612387264,1693002.6048705666,401876.5612008102,1223624.4891694314,2443881.3195215743
301,AUTO POSTO SAO CHARBEL LTDA,"AVENIDA RUBENS DE MENDONÇA, 1578",Bosque da Saúde,RAIZEN,3.879,NA,"NA","NA",2020-04-28,CUIABA,Gasolina,R$/l,2020-04-26,2020-05-02,MATO GROSSO,5103403,"AVENIDA RUBENS DE MENDONÇA, 1578, Bosque da Saúde, CUIABA, MATO GROSSO, BRAZIL",-56.08157989999999,-15.5868976,221376.913558374,182552.3287314504,13722.436513472534,425277.1120207831,1696042.3582180599,400637.14887701115,1228537.3757823603,2444279.6109647383
302,AUTO POSTO CUIABA PETRO LTDA,"RUA GENERAL VALE, 636",Bandeirantes,IPIRANGA,3.879,NA,"NA","NA",2020-04-28,CUIABA,Gasolina,R$/l,2020-04-26,2020-05-02,MATO GROSSO,5103403,"RUA GENERAL VALE, 636, Bandeirantes, CUIABA, MATO GROSSO, BRAZIL",-56.0895136,-15.6020975,221559.09727685194,183288.6719695314,12809.040977907262,427071.4790170452,1696158.5954638682,401288.66053982516,1228063.9310389683,2445784.4229262117
303,RIBANCEIRA COMÉRCIO DE COMBUSTÍVEIS E LUBRIFICANTES LTDA,"AVENIDA FERNANDO CORREA DA COSTA, 4400 0",Jd.alencastro,IPIRANGA,3.879,NA,"NA","NA",2020-04-28,CUIABA,Gasolina,R$/l,2020-04-26,2020-05-02,MATO GROSSO,5103403,"AVENIDA FERNANDO CORREA DA COSTA, 4400 0, Jd.alencastro, CUIABA, MATO GROSSO, BRAZIL",-56.0571377,-15.6277429,219324.622688915,184762.14431869047,8943.361078596174,429346.0601683377,1692988.513888597,401902.43883342843,1223582.7903304356,2443922.101113512
304,LORIANA ANDRADE DA FONSECA,"AVENIDA DANTE M. DE OLIVEIRA, 911",Bosque da Saude Ii,BRANCA,3.879,NA,"NA","NA",2020-04-28,CUIABA,Gasolina,R$/l,2020-04-26,2020-05-02,MATO GROSSO,5103403,"AVENIDA DANTE M. DE OLIVEIRA, 911, Bosque da Saude Ii, CUIABA, MATO GROSSO, BRAZIL",-56.0613294,-15.5890652,220234.47010564883,182737.01468152908,11989.04048237582,425181.3559857012,1694486.158552151,400499.8449335389,1226750.6668888892,2442435.5856410675
305,METROPOLITANO COMERCIO DE COMBUSTIVEIS E DERIVADOS LTDA,"AVENIDA FERNANDO CORREA DA COSTA, 2350",Jardim Petropolis,PETROBRAS DISTRIBUIDORA S.A.,3.888,NA,"NA","NA",2020-04-28,CUIABA,Gasolina,R$/l,2020-04-26,2020-05-02,MATO GROSSO,5103403,"AVENIDA FERNANDO CORREA DA COSTA, 2350, Jardim Petropolis, CUIABA, MATO GROSSO, BRAZIL",-56.0703207,-15.6171845,220222.16082740316,184164.69237463703,10756.097143786541,428402.92014249647,1694282.4895607089,401646.7430530168,1225415.8838215484,2444673.842114921
306,BORGES & GONTIJO LTDA,"AVENIDA GETULIO VARGAS, 738",Goiabeiras,BRANCA,3.89,NA,"NA","NA",2020-04-27,CUIABA,Gasolina,R$/l,2020-04-26,2020-05-02,MATO GROSSO,5103403,"AVENIDA GETULIO VARGAS, 738, Goiabeiras, CUIABA, MATO GROSSO, BRAZIL",-56.1000252,-15.594205,222302.87373941112,182816.40774209215,12706.3668688336,426388.03848622064,1697175.2000223969,401108.0719697273,1229487.1944378202,2446411.812196477
307,COMERCIO DE COMBUSTIVEIS BURITI LTDA,"RUA MIRANDA REIS, 400",Pocao,PETROBRAS DISTRIBUIDORA S.A.,3.89,NA,"NA","NA",2020-04-28,CUIABA,Gasolina,R$/l,2020-04-26,2020-05-02,MATO GROSSO,5103403,"RUA MIRANDA REIS, 400, Pocao, CUIABA, MATO GROSSO, BRAZIL",-56.09036339999999,-15.6035375,221586.68226226637,183352.99641426466,12632.088314224608,427243.1702924385,1696176.914719633,401351.4816445389,1228027.1171667222,2445936.4572649924
308,PAPAI AUTO POSTO CUIABÁ LTDA.,"AVENIDA MARECHAL DEODORO, 911",Araes,PETROBRAS DISTRIBUIDORA S.A.,3.897,NA,"NA","NA",2020-04-27,CUIABA,Gasolina,R$/l,2020-04-26,2020-05-02,MATO GROSSO,5103403,"AVENIDA MARECHAL DEODORO, 911, Araes, CUIABA, MATO GROSSO, BRAZIL",-56.097098,-15.5880553,222237.73349366777,182524.8353614844,13434.965711774508,425666.10843817674,1697148.845744541,400847.82434332784,1229701.1610715897,2445830.398249794
309,RIBEIRO MIGUEL SUTIL AUTO POSTO LTDA,"AVENIDA MIGUEL SUTIL, S/N ESQ. C/TRAV. JOAO BENTO",Duque de Caxias,PETROBRAS DISTRIBUIDORA S.A.,3.899,NA,"NA","NA",2020-04-27,CUIABA,Gasolina,R$/l,2020-04-26,2020-05-02,MATO GROSSO,5103403,"AVENIDA MIGUEL SUTIL, S/N ESQ. C/TRAV. JOAO BENTO, Duque de Caxias, CUIABA, MATO GROSSO, BRAZIL",-56.1182002,-15.6222728,223065.4306035297,183927.11155740634,9073.539597691126,429768.30307515035,1697653.501921412,402349.38195247727,1228904.261365655,2449529.7926434954
310,COMERCIAL AMAZONIA DE PETROLEO EIRELI,"AVENIDA FERNANDO CORREA DA COSTA, 4.881",Parque Ohara,BRANCA,3.899,NA,"NA","NA",2020-04-28,CUIABA,Gasolina,R$/l,2020-04-26,2020-05-02,MATO GROSSO,5103403,"AVENIDA FERNANDO CORREA DA COSTA, 4.881, Parque Ohara, CUIABA, MATO GROSSO, BRAZIL",-56.0472736,-15.6333759,218690.00208079588,185100.05260640985,7715.701863089892,429807.37015792506,1692090.178217494,402009.7437911713,1222376.9480687564,2443249.367631541
311,EMBOAVA DIAS COMERCIO DE COMBUSTIVEIS LTDA,"AVENIDA GENERAL MELLO, 1480 ESQ. C/ MIGUEL SUTIL",Campo Velho,PETROBRAS DISTRIBUIDORA S.A.,3.899,NA,"NA","NA",2020-04-28,CUIABA,Gasolina,R$/l,2020-04-26,2020-05-02,MATO GROSSO,5103403,"AVENIDA GENERAL MELLO, 1480 ESQ. C/ MIGUEL SUTIL, Campo Velho, CUIABA, MATO GROSSO, BRAZIL",-56.08449299999999,-15.6122719,221116.2550949267,183820.0339865868,12339.76382658818,428099.3013591564,1695476.4687452316,401614.4830403336,1226916.136967526,2445797.6160588637
312,COMERCIAL DE COMBUSTIVEIS SANTA EDWIGES LTDA,"AVENIDA HIST. RUBENS DE MENDONCA, 119 ESQ. C/ AVE. ALENKER",Cpa I,PETROBRAS DISTRIBUIDORA S.A.,3.899,NA,"NA","NA",2020-04-28,CUIABA,Gasolina,R$/l,2020-04-26,2020-05-02,MATO GROSSO,5103403,"AVENIDA HIST. RUBENS DE MENDONCA, 119 ESQ. C/ AVE. ALENKER, Cpa I, CUIABA, MATO GROSSO, BRAZIL",-56.0505461,-15.5458505,220831.0225047063,180115.8938358664,15253.643654753874,420280.0193010767,1695030.3526102998,398777.4250332698,1229058.5555486113,2439292.0046425667
313,COMERCIAL AMAZONIA DE PETROLEO EIRELI,"AVENIDA MIGUEL SUTIL, 13385",Porto,BRANCA,3.899,NA,"NA","NA",2020-04-27,CUIABA,Gasolina,R$/l,2020-04-26,2020-05-02,MATO GROSSO,5103403,"AVENIDA MIGUEL SUTIL, 13385, Porto, CUIABA, MATO GROSSO, BRAZIL",-56.1193184,-15.6207489,223148.4009763794,183850.6221808156,9123.115124473461,429621.57067286357,1697782.5953394333,402304.5430428756,1229105.5372383585,2449563.0957594193
314,"D. SERVICE AUTO POSTO, CONVENIENCIA E ACESSORIOS PARA AUTOS LTDA","AVENIDA MANOEL JOSE DE ARRUDA, 2933",Jardim Europa,IPIRANGA,3.899,NA,"NA","NA",2020-04-28,CUIABA,Gasolina,R$/l,2020-04-26,2020-05-02,MATO GROSSO,5103403,"AVENIDA MANOEL JOSE DE ARRUDA, 2933, Jardim Europa, CUIABA, MATO GROSSO, BRAZIL",-56.084854,-15.6252487,220988.90896578925,184403.8469473352,11558.89124996398,429523.8359442529,1695105.0655612086,402103.7140677443,1225997.6663281892,2446466.1728053456
315,RENASCENCA AUTO POSTO LTDA,"RUA VILA MARIA, 177A",Bau,IDAZA,3.899,NA,"NA","NA",2020-04-28,CUIABA,Gasolina,R$/l,2020-04-26,2020-05-02,MATO GROSSO,5103403,"RUA VILA MARIA, 177A, Bau, CUIABA, MATO GROSSO, BRAZIL",-56.0916271,-15.5928649,221835.3669275387,182808.85705875323,13399.06166117973,426098.34751612786,1696598.0795964194,400967.57131266873,1228909.0847478344,2445537.842047638
316,PARADISE AUTO POSTO CUIABA LTDA,"RUA BARAO DE MELGACO, 1029 ESQ C/ AV 8 DE ABRIL",Porto,PETROBRAS DISTRIBUIDORA S.A.,3.899,NA,"NA","NA",2020-04-27,CUIABA,Gasolina,R$/l,2020-04-26,2020-05-02,MATO GROSSO,5103403,"RUA BARAO DE MELGACO, 1029 ESQ C/ AV 8 DE ABRIL, Porto, CUIABA, MATO GROSSO, BRAZIL",-56.1160247,-15.615463,222991.63812930076,183661.2311059586,9798.629006841962,428986.78057966824,1697701.6168428804,402072.02895862004,1229224.9981604484,2448988.2774086203
317,AUTO POSTO CANELA LTDA,"AVENIDA TENENTE CORONEL DUARTE, 2148",Dom Aquino,IDAZA,3.899,NA,"NA","NA",2020-04-28,CUIABA,Gasolina,R$/l,2020-04-26,2020-05-02,MATO GROSSO,5103403,"AVENIDA TENENTE CORONEL DUARTE, 2148, Dom Aquino, CUIABA, MATO GROSSO, BRAZIL",-56.101216,-15.612316999999999,222115.78807459594,183673.1065150026,11122.218355544057,428386.85008380207,1696706.7027560968,401795.5272362017,1228260.2998021913,2447409.3561158217
318,COMERCIAL AMAZONIA DE PETROLEO EIRELI,"AVENIDA MIGUEL SUTIL, 9920",Santa Rosa,BRANCA,3.899,NA,"NA","NA",2020-04-27,CUIABA,Gasolina,R$/l,2020-04-26,2020-05-02,MATO GROSSO,5103403,"AVENIDA MIGUEL SUTIL, 9920, Santa Rosa, CUIABA, MATO GROSSO, BRAZIL",-56.110435,-15.579806,223168.46761854476,182004.06738739894,13382.88488179852,424996.23758347915,1698384.8959015217,400686.2859700543,1231377.9548482613,2446713.6152595673
319,COMERCIAL AMAZONIA DE PETROLEO EIRELI,"AVENIDA HISTORIADOR RUBENS DE MENDONCA, 3075",Alvorada,BRANCA,3.899,NA,"NA","NA",2020-04-28,CUIABA,Gasolina,R$/l,2020-04-26,2020-05-02,MATO GROSSO,5103403,"AVENIDA HISTORIADOR RUBENS DE MENDONCA, 3075, Alvorada, CUIABA, MATO GROSSO, BRAZIL",-56.074303,-15.576133,221210.1680724645,181982.56174514038,13984.723058804724,423979.3217438654,1695839.003635412,400158.320714705,1228740.9749824808,2443054.43846876
320,COMERCIO DE COMBUSTIVEIS PIONEIRA LTDA,"RODOVIA PALMIRO PAES DE BARROS KM 02, S/N",Jd. Jockei Club,PETROBRAS DISTRIBUIDORA S.A.,3.899,NA,"NA","NA",2020-04-28,CUIABA,Gasolina,R$/l,2020-04-26,2020-05-02,MATO GROSSO,5103403,"RODOVIA PALMIRO PAES DE BARROS KM 02, S/N, Jd. Jockei Club, CUIABA, MATO GROSSO, BRAZIL",-56.0446232,-15.6759648,218520.48625735042,186570.438431031,6462.175425882013,434429.67850727827,1690592.8987812256,403590.3784866762,1219054.8929358448,2445084.4658826045
321,MARMELEIRO AUTO POSTO LTDA,"AVENIDA MIGUEL SUTIL, 11954",Cidade Verde,IDAZA,3.899,NA,"NA","NA",2020-04-27,CUIABA,Gasolina,R$/l,2020-04-26,2020-05-02,MATO GROSSO,5103403,"AVENIDA MIGUEL SUTIL, 11954, Cidade Verde, CUIABA, MATO GROSSO, BRAZIL",-56.1287446,-15.6112535,223833.7411760539,183333.42149573544,9388.598820992536,428752.2512678976,1698768.4816242005,402052.3435891804,1230558.1599416826,2450007.7559717232
322,RENASCENCA AUTO POSTO LTDA,"AVENIDA MAL. DEODORO, 309",Santa Helena,IDAZA,3.899,NA,"NA","NA",2020-04-27,CUIABA,Gasolina,R$/l,2020-04-26,2020-05-02,MATO GROSSO,5103403,"AVENIDA MAL. DEODORO, 309, Santa Helena, CUIABA, MATO GROSSO, BRAZIL",-56.0933376,-15.5840096,222096.6307603377,182337.063625377,14036.049388070205,425159.9206826767,1696996.5874606092,400656.8374750156,1229694.5257164547,2445271.2385613443
323,COMERCIO DE COMBUSTIVEIS SAO CARLOS LTDA,"AVENIDA GOVERNADOR DANTE MARTINS DE OLIVEIRA, 01",Carumbe,RAIZEN,3.899,NA,"NA","NA",2020-04-28,CUIABA,Gasolina,R$/l,2020-04-26,2020-05-02,MATO GROSSO,5103403,"AVENIDA GOVERNADOR DANTE MARTINS DE OLIVEIRA, 01, Carumbe, CUIABA, MATO GROSSO, BRAZIL",-56.0369767,-15.5800357,219255.50348996467,182166.53891622365,11235.296535823665,423807.25028804445,1692975.4615805042,399901.6113420848,1225457.7785284698,2439650.749805779
324,PANAMERICANO AUTO POSTO CUIABÁ LTDA.,"AVENIDA DANTE MARTINS DE OLIVEIRA, 678",Areão,BRANCA,3.899,NA,"NA","NA",2020-04-28,CUIABA,Gasolina,R$/l,2020-04-26,2020-05-02,MATO GROSSO,5103403,"AVENIDA DANTE MARTINS DE OLIVEIRA, 678, Areão, CUIABA, MATO GROSSO, BRAZIL",-56.0350601,-15.5765518,219263.70390433626,181939.81096867056,11473.61164419526,423396.0553995016,1692942.4175941295,399751.09256081656,1225559.9482401258,2439296.242267967
325,"LIDERGÁS TRANSPORTE, COMÉRCIO E DISTRIBUIDORA LTDA.","AVENIDA COXIPO MIRIM, 240",Novo Horizonte,BRANCA,3.979,NA,"NA","NA",2020-04-28,CUIABA,Gasolina,R$/l,2020-04-26,2020-05-02,MATO GROSSO,5103403,"AVENIDA COXIPO MIRIM, 240, Novo Horizonte, CUIABA, MATO GROSSO, BRAZIL",-56.01037969999999,-15.5601814,218754.1097845895,180615.9019133063,12254.330811411592,421227.7902918615,1691638.505376384,398875.7506785708,1224786.838172355,2436121.5011926056
326,DEM & DEM COMERCIO DE COMBUSTIVES LTDA,"AVENIDA DEPUTADO MILTON FIGUEIREDO, 645 SETOR CENTRO NORTE",Morada do Ouro,BRANCA,3.979,NA,"NA","NA",2020-04-28,CUIABA,Gasolina,R$/l,2020-04-26,2020-05-02,MATO GROSSO,5103403,"AVENIDA DEPUTADO MILTON FIGUEIREDO, 645 SETOR CENTRO NORTE, Morada do Ouro, CUIABA, MATO GROSSO, BRAZIL",-56.0604957,-15.567556,220706.90220844434,181487.66786094927,13769.539335644904,422815.0439002558,1695088.9439351547,399690.36592097406,1228261.3417039702,2441306.91340182
327,REDE VIP COMERCIO DE COMBUSTIVEL E SERVICOS LTDA,"AVENIDA REPUBLICA DO LIBANO, 30",Rodoviaria Parque,IPIRANGA,3.989,NA,"NA","NA",2020-04-27,CUIABA,Gasolina,R$/l,2020-04-26,2020-05-02,MATO GROSSO,5103403,"AVENIDA REPUBLICA DO LIBANO, 30, Rodoviaria Parque, CUIABA, MATO GROSSO, BRAZIL",-56.08789359999999,-15.5805202,221858.05538976574,182179.02547563965,14696.64995485579,424686.26857850084,1696703.4458305445,400468.3159534812,1229512.0395047686,2444577.013671033
328,AUTO POSTO M J LTDA.,"RUA COMANDANTE COSTA, 2240",Porto,IPIRANGA,3.989,NA,"NA","NA",2020-04-27,CUIABA,Gasolina,R$/l,2020-04-26,2020-05-02,MATO GROSSO,5103403,"RUA COMANDANTE COSTA, 2240, Porto, CUIABA, MATO GROSSO, BRAZIL",-56.108417,-15.6059452,222632.96562098703,183310.58366187548,11130.330853820387,427815.0368513718,1697432.7367787322,401635.5071917829,1229305.788086516,2447791.8912499803
329,AUTO POSTO GOIABEIRAS LTDA,"AVENIDA SEBASTIÃO GOMES GUIMARÃES, 07",Nova Esperança I,BRANCA,3.989,NA,"NA","NA",2020-04-27,CUIABA,Gasolina,R$/l,2020-04-26,2020-05-02,MATO GROSSO,5103403,"AVENIDA SEBASTIÃO GOMES GUIMARÃES, 07, Nova Esperança I, CUIABA, MATO GROSSO, BRAZIL",-55.96316419999999,-15.6309972,215306.53322668181,184168.4942380522,4613.371189062564,428328.89156066056,1685987.7938016292,401037.42535213946,1215794.3433621994,2435049.287099471
330,MONTE LIBANO AUTO POSTO LTDA,"AVENIDA REPUBLICA DO LIBANO, 535",Despraiado,RAIZEN,3.999,NA,"NA","NA",2020-04-27,CUIABA,Gasolina,R$/l,2020-04-26,2020-05-02,MATO GROSSO,5103403,"AVENIDA REPUBLICA DO LIBANO, 535, Despraiado, CUIABA, MATO GROSSO, BRAZIL",-56.0874675,-15.5765,221918.0630672593,181961.81103417894,14960.287593766467,424239.77412168164,1696796.043493258,400314.4411401362,1229772.1734636326,2444340.2641973216
331,G. J. G. DERIVADOS DE PETROLEO LTDA,"AVENIDA CARMINDO DE CAMPOS, 1621",Jardim Paulista,RAIZEN,3.999,NA,"NA","NA",2020-04-28,CUIABA,Gasolina,R$/l,2020-04-26,2020-05-02,MATO GROSSO,5103403,"AVENIDA CARMINDO DE CAMPOS, 1621, Jardim Paulista, CUIABA, MATO GROSSO, BRAZIL",-56.0827158,-15.6211091,220902.83641754717,184242.16685144015,11708.876273788124,429035.7801518708,1695074.498835648,401925.92963550525,1226127.536550699,2446058.1846729717
332,B & M COMERCIAL DE COMBUSTIVEIS E LUBRIFICANTES LTDA,"AVENIDA MIGUEL SUTIL, 5527",Araes,RAIZEN,3.999,NA,"NA","NA",2020-04-27,CUIABA,Gasolina,R$/l,2020-04-26,2020-05-02,MATO GROSSO,5103403,"AVENIDA MIGUEL SUTIL, 5527, Araes, CUIABA, MATO GROSSO, BRAZIL",-56.09461229999999,-15.5783781,222280.03936615543,182029.91705957576,14450.467002046456,424566.46729626786,1697263.9245355835,400461.57990379294,1230209.221305465,2445119.8919815463
333,PETROPAULO COMERCIO DE DERIVADOS DE PETROLEO LTDA.,"AVENIDA MIGUEL SUTIL, 6692",Jardim Santa Marta,RAIZEN,3.999,NA,"NA","NA",2020-04-27,CUIABA,Gasolina,R$/l,2020-04-26,2020-05-02,MATO GROSSO,5103403,"AVENIDA MIGUEL SUTIL, 6692, Jardim Santa Marta, CUIABA, MATO GROSSO, BRAZIL",-56.1017912,-15.575715,222743.30094847985,181846.89431775128,14256.450859171258,424399.07351563853,1697874.4473506575,400440.7447432039,1230981.6223129984,2445681.8970029177
334,G. J. G. DERIVADOS DE PETROLEO LTDA,"AVENIDA DOS TRABALHADORES, 4895 E",Jd. Três Lagoas,RAIZEN,3.999,NA,"NA","NA",2020-04-28,CUIABA,Gasolina,R$/l,2020-04-26,2020-05-02,MATO GROSSO,5103403,"AVENIDA DOS TRABALHADORES, 4895 E, Jd. Três Lagoas, CUIABA, MATO GROSSO, BRAZIL",-56.0340334,-15.5749269,219263.06886013367,181831.71275698082,11582.232010849048,423202.2352943082,1692917.2841063882,399679.47860729037,1225596.9988373842,2439118.122119751
335,G. J. G. DERIVADOS DE PETROLEO LTDA,"AVENIDA FERNANDO CORREA DA COSTA, 8200",Jardim Comodoro,RAIZEN,3.999,NA,"NA","NA",2020-04-28,CUIABA,Gasolina,R$/l,2020-04-26,2020-05-02,MATO GROSSO,5103403,"AVENIDA FERNANDO CORREA DA COSTA, 8200, Jardim Comodoro, CUIABA, MATO GROSSO, BRAZIL",-56.06034529999999,-15.6251991,219540.96039696396,184618.90333394395,9382.244378907826,429118.7989727193,1693302.5317718936,401840.98686914967,1224026.9597753282,2444106.1268684114
336,AUTO POSTO ARENA COMERCIO DE COMBUSTIVEIS LTDA,"AVENIDA SAO SEBASTIAO, 1153",Cidade Alta,RAIZEN,3.999,NA,"NA","NA",2020-04-27,CUIABA,Gasolina,R$/l,2020-04-26,2020-05-02,MATO GROSSO,5103403,"AVENIDA SAO SEBASTIAO, 1153, Cidade Alta, CUIABA, MATO GROSSO, BRAZIL",-56.11349999999999,-15.6025616,222988.1392543806,183103.03264389618,11094.837002937054,427534.1346336117,1697911.1372584116,401564.3977221941,1229962.4681698598,2448116.4368992806
337,MORADA AUTO POSTO LTDA,"AVENIDA MIGUEL SUTIL, 200",Duque de Caxias,RAIZEN,3.999,NA,"NA","NA",2020-04-27,CUIABA,Gasolina,R$/l,2020-04-26,2020-05-02,MATO GROSSO,5103403,"AVENIDA MIGUEL SUTIL, 200, Duque de Caxias, CUIABA, MATO GROSSO, BRAZIL",-56.109272,-15.57875,223119.56806599145,181957.72368182917,13547.106440358046,424860.59753571515,1698331.7635043012,400634.51289786387,1231361.5636584042,2446550.2137156534
338,B & M COMERCIAL DE COMBUSTIVEIS E LUBRIFICANTES LTDA,"AVENIDA MIGUEL SUTIL, 9275",Duque de Caxias I,RAIZEN,3.999,NA,"NA","NA",2020-04-27,CUIABA,Gasolina,R$/l,2020-04-26,2020-05-02,MATO GROSSO,5103403,"AVENIDA MIGUEL SUTIL, 9275, Duque de Caxias I, CUIABA, MATO GROSSO, BRAZIL",-56.1113513,-15.583089,223163.4225817001,182165.95016101975,13020.690267993623,425370.69030324614,1698351.3192006769,400817.9371757069,1231211.6962163572,2446961.5721183326
339,ESTACAO AUTO POSTO EIRELI,"RODOVIA PALMIRO PAES DE BARROS, 1.239",Jardim Mossoro,RAIZEN,3.999,NA,"NA","NA",2020-04-28,CUIABA,Gasolina,R$/l,2020-04-26,2020-05-02,MATO GROSSO,5103403,"RODOVIA PALMIRO PAES DE BARROS, 1.239, Jardim Mossoro, CUIABA, MATO GROSSO, BRAZIL",-56.05159159999999,-15.6527999,218821.784522097,185841.48317065375,7349.866596986631,432001.24473516486,1691813.064899676,402787.15650310693,1221306.0777574177,2444616.5520964777
340,COMERCIAL DE COMBUSTIVEIS PARAISO EIRELI,"AVENIDA JOSE TORQUATO, 2.896 HIST. RUBENS MENDONCA",Novo Paraiso,BRANCA,4.07,NA,"NA","NA",2020-04-28,CUIABA,Gasolina,R$/l,2020-04-26,2020-05-02,MATO GROSSO,5103403,"AVENIDA JOSE TORQUATO, 2.896 HIST. RUBENS MENDONCA, Novo Paraiso, CUIABA, MATO GROSSO, BRAZIL",-56.0558723,-15.5479504,221015.39893394944,180277.07877174972,15323.460451432808,420595.57988715376,1695356.3410034745,398913.08889982075,1229330.9604257387,2439907.3394778366
341,PEGORARO COMÉRCIO DE DERIVADOS DE PETRÓLEO LTDA.,"RUA BARÃO DE MELGAÇO, 1575 EM FRENTE ACADEMIA MOVIMENTO",Porto,IPIRANGA,4.397,NA,"NA","NA",2020-04-27,CUIABA,Gasolina,R$/l,2020-04-26,2020-05-02,MATO GROSSO,5103403,"RUA BARÃO DE MELGAÇO, 1575 EM FRENTE ACADEMIA MOVIMENTO, Porto, CUIABA, MATO GROSSO, BRAZIL",-56.109813,-15.609548,222673.1619535918,183462.77160262543,10727.777435856764,428232.6748541209,1697425.0800002124,401784.7429934985,1229155.4147548708,2448101.90755866
342,AUTO POSTOS ANDRADE LTDA,"RUA LARANJEIRAS, 760",Centro,BRANCA,3.9,NA,"NA","NA",2020-04-27,ARACAJU,Gasolina,R$/l,2020-04-26,2020-05-02,SERGIPE,2800308,"RUA LARANJEIRAS, 760, Centro, ARACAJU, SERGIPE, BRAZIL",-37.05506889999999,-10.9115168,222375.96087260966,88822.8159446515,8948.714053795053,360095.3461486382,1464043.2077849652,805434.4081992623,237087.62679121303,2803993.3530247444
343,REDE DE POSTOS PRESIDENTE LTDA,"RUA LARANJEIRAS, 1781",Getulio Vargas,PETROBRAS DISTRIBUIDORA S.A.,3.9,NA,"NA","NA",2020-04-27,ARACAJU,Gasolina,R$/l,2020-04-26,2020-05-02,SERGIPE,2800308,"RUA LARANJEIRAS, 1781, Getulio Vargas, ARACAJU, SERGIPE, BRAZIL",-37.064527,-10.9115998,221978.6606458068,88896.60059417221,8230.915069953204,360764.6430775606,1463585.840634125,805238.0609780131,236476.7439868481,2803450.91800239
344,POSTO SÃO CARLOS LTDA,"AVENIDA RIO BRANCO, 353",Centro,PETROX DISTRIBUIDORA,3.979,NA,"NA","NA",2020-04-27,ARACAJU,Gasolina,R$/l,2020-04-26,2020-05-02,SERGIPE,2800308,"AVENIDA RIO BRANCO, 353, Centro, ARACAJU, SERGIPE, BRAZIL",-37.0477279,-10.9095295,222744.83328993147,88832.73940468076,9411.296850368231,359413.3676743451,1464490.830474592,805639.5767845333,237735.9679836513,2804596.5573011697
345,A.C. COMERCIO DE COMBUSTIVEIS LTDA,"AVENIDA ADELIA FRANCO, 3380",Inacio Barbosa,BRANCA,3.99,NA,"NA","NA",2020-04-27,ARACAJU,Gasolina,R$/l,2020-04-26,2020-05-02,SERGIPE,2800308,"AVENIDA ADELIA FRANCO, 3380, Inacio Barbosa, ARACAJU, SERGIPE, BRAZIL",-37.0700446,-10.9443558,220892.27386493218,87539.77507152523,10907.634626570016,363936.17628682044,1461752.6324687628,804225.0557878688,233185.31096189725,2800037.786651343
346,AMARAL E CIA LTDA.,"RUA MARIANO SALMERON, 709",Siqueira Campos,PETROBRAS DISTRIBUIDORA S.A.,3.999,NA,"NA","NA",2020-04-27,ARACAJU,Gasolina,R$/l,2020-04-26,2020-05-02,SERGIPE,2800308,"RUA MARIANO SALMERON, 709, Siqueira Campos, ARACAJU, SERGIPE, BRAZIL",-37.0736973,-10.910872,221624.8302125916,88988.48274689498,7532.944132346495,361346.7667593347,1463182.025765461,805069.3054639257,235960.11533031153,2803001.757062055
347,POSTO BEL SANTA RITA LTDA,"RUA FIRMINO FONTES, 233",Farolandia,PETROBRAS DISTRIBUIDORA S.A.,3.999,NA,"NA","NA",2020-04-27,ARACAJU,Gasolina,R$/l,2020-04-26,2020-05-02,SERGIPE,2800308,"RUA FIRMINO FONTES, 233, Farolandia, ARACAJU, SERGIPE, BRAZIL",-37.0537478,-10.9831101,220579.27524202125,85856.01198422973,15541.369774111628,366126.8435770604,1460690.243577117,803490.7007658782,230798.32437950792,2797292.860515782
348,POSTO VALADARES LTDA,"RUA NICEU DANTAS, S/N",Atalaia Velha,PETROBRAS DISTRIBUIDORA S.A.,3.999,NA,"NA","NA",2020-04-27,ARACAJU,Gasolina,R$/l,2020-04-26,2020-05-02,SERGIPE,2800308,"RUA NICEU DANTAS, S/N, Atalaia Velha, ARACAJU, SERGIPE, BRAZIL",-37.0526972,-10.9930003,220383.17990150015,85446.10317234005,16582.584599738322,366906.2053087818,1460271.1506303267,803240.3657117708,229994.71836728978,2796416.882897349
